title,description,relevance_score,matched_keywords,matched_groups,keyword_frequencies
AENT 4853 - Water Resources Technology,"3 Students understand the fundamentals of a broad range of water supply and water quality problems, including pumps and pumping, water storage, waste treatment, point and non-point source pollution as they impact both surface and ground water systems.",1.5,Water Quality,technical_skills-1,"{""water quality"": 1}"
AENT 3853 - Power for Agriculture,"3 Students study the fundamentals of design, operation, performance and maintenance of tractors and their internal combustion power units as used on farms. Students experience the selection, service and repair of farm tractors.",2.5,Combustion,engineering_capabilities-2,"{""combustion"": 1}"
AENT 3813 - Air Conditioning and Refrigeration,"3 Students apply thermodynamics, fluid mechanics, and heat transfer to the design of heating, ventilating and air conditioning systems. Students understand the principles of operation and the selection of equipment.",1.5,Heat Transfer,technical_skills-1,"{""heat transfer"": 1}"
CHEM 3341L - Principles of Analytical Chemistry Lab,"1 Students explore statistics, sampling, chemical equilibrium titrimetric procedures, spectroscopy separations and electrochemistry and are introduced to modern analytical instrumentation. Students write reports using statistical analysis in evaluating procedures.",2.5,Electrochemistry,engineering_capabilities-2,"{""electrochemistry"": 1}"
CHEM 3341K - Principles of Analytical Chemistry,"3 Students explore statistics, sampling, chemical equilibrium titrimetric procedures, spectroscopy separations and electrochemistry and are introduced to modern analytical instrumentation. Students write reports using statistical analysis in evaluating procedures.",2.5,Electrochemistry,engineering_capabilities-2,"{""electrochemistry"": 1}"
BIOL 3345 - Principles of Toxicology,"3 Principles of Toxicology will provide a comprehensive overview of chemical effects on biological systems. Students will be introduced to key principles of toxicology including dose response,disposition of toxicants, non-organ directed toxicity, target organ toxicity, evironmental toxicology and applications of toxicology. Students will apply their knowledge of the molecular and cellular sites of action and physiological effects of specific xenobiotics to risk assessment.",1.5,Risk Assessment,technical_skills-1,"{""risk assessment"": 1}"
ELET 4998L - Engineering Technology Design I Lab,"Advance topics in electronic &/or agricultural system design, the design process and project management: a major design project sequence that include preliminary analysis, working drawing and schematics; preliminary design and its presentation. Lab course.",2.5,Project Management,engineering_capabilities-2,"{""project management"": 1}"
GEOG 4406 - Methods of Geography Research II,"3 Students become familiar with some of the historic trends in geographic research and learn what geographers are doing today. Special emphasis is placed on recent technologies available to geographers such as, geographic information systems, global positioning systems, cartography, advanced statistical analysis software, etc. Students learn to design a research project within their area of geographic interests.",2.5,Geographic Information Systems,engineering_capabilities-2,"{""geographic information systems"": 1}"
