title,description,relevance_score,matched_keywords,matched_groups,keyword_frequencies
CHE 4450 - Chemical Process Synthesis and Design I (3),Design of major equipment common to most chemical industries. Emphasis on how equipment fits together and interacts in an integrated process. Design of steam and refrigeration cycles. Treatment of process design methodology. Process flow diagrams and piping and instrumentation diagrams. Energy integration in plant design. Optimization strategies in process design. Introduction to ammonia synthesis and oil refining. Use of process simulators. CHE 304 or ; CHE 312 or CHE 4450L. Lecture Graded Only May be taken only once Major Required Course,2.5,Piping and Instrumentation Diagram,engineering_capabilities-2,"{""piping and instrumentation diagram"": 1}"
CHE 4450L - Chemical Process Synthesis and Design I Laboratory (1),"Design of major equipment common to most chemical industries. Emphasis on how equipment fits together and interacts in an integrated process. Design of steam and refrigeration cycles. Treatment of process design methodology. Process flow diagrams and piping and instrumentation diagrams. Energy integration in plant design. Optimization strategies in process design. Introduction to ammonia synthesis and oil refining. Use of process simulators. CHE 304 or CHE 3040, CHE 312 or CHE 3121, CHE 333L or CHE 3331L, and CHE 303 or CHE 3031. CHE 4450. Laboratory Graded Only May be taken only once Major Required Course",2.5,Piping and Instrumentation Diagram,engineering_capabilities-2,"{""piping and instrumentation diagram"": 1}"
CHE 4361L - Unit Operation and Process Control Laboratory (1),"Treatment of mass, momentum and heat transport viewed with the traditional unit operations emphasis. Multi-component and multiphase systems are considered, with some problems involving design. Distillation, absorption and heat exchanger design. Experimental study of the dynamics and control of chemical engineering processes using single-loop, PID controllers. Simulation of real control systems. Hardware requirements for real control systems. ECE 231 or ; CHE 333L or ; and CHE 4251. CHE 426 or CHE4260. Laboratory Graded Only May be taken only once Major Required Course",5.0,Chemical Engineering;Process Control;Control Systems,technical_skills-1;engineering_capabilities-2,"{""chemical engineering"": 1, ""control systems"": 2, ""process control"": 1}"
CHE 4260 - Process Controls (2),"Introduction to theory, design, and application of automatic control systems to chemical and physical processes. Topics include transfer function, control valve sizing, PID controller tuning, multivariable process control, and MATLAB Simulink. 2 hours lectures/problem-solving. , and CHE 333L or . Lecture 2 hours lectures/problem-solving. Graded Only May be taken only once Major Course",2.5,Process Control;Control Systems,technical_skills-1,"{""control systems"": 1, ""process control"": 2}"
CHE 3331L - Transport Laboratory II (1),"Applying experimental design and the basic concepts in transport phenomena in experimental study of both chemical and materials engineering systems that may involve diffusivity measurement, batch distillation, heat exchanger, membrane separation, droplet evaporation, heat transfer in extended surfaces and others. CHE 311 or , and CHE 322L or . . Laboratory Graded Only May be taken only once Major Course",4.0,Heat Transfer;Materials Engineering,technical_skills-1;engineering_capabilities-2,"{""materials engineering"": 1, ""heat transfer"": 1}"
CHE 3221L - Transport Laboratory I (1),"Applying experimental design and the basic concepts in transport phenomena and thermodynamics in experimental study of systems that may involve pressure drop in pipes, flow measurement, viscosity measurement, heat of combustion measurement, energy and entropy balance, pump operating characteristics and measurement of transport properties of both chemical and materials engineering systems CHE 202 or ; CHE 132 or ; and CHE 1421L. . Laboratory Graded Only May be taken only once Major Required Course",3.0,Combustion;Materials Engineering,engineering_capabilities-2,"{""materials engineering"": 1, ""combustion"": 1}"
CHE 3121 - Transport Phenomena II (4),"Heat and mass transport with applications to the unit operations of chemical engineering. Topics include steady and transient heat transfer, convective heat transfer, radiation heat transfer, heat exchanger design, steady and transient mass transfer, convective mass transfer, distillation, absorption, stripping, and water treatment.Mass transport with applications to the unit operations of chemical engineering and environmental problems, including topics in distillation, absorption, stripping, flue gas desulfurization, and water chemical, physicochemical, and biological treatment. CHE 311 or . . Lecture 4 hours lecture/discussion Graded Only May be taken only once Major Course",5.5,Chemical Engineering;Heat Transfer,technical_skills-1;engineering_capabilities-2,"{""chemical engineering"": 2, ""heat transfer"": 3}"
CHE 3111 - Transport Phenomena I (3),"Introduction to fluid mechanics and heat transfer with application to the unit operations of chemical engineering. Topics include dimensional analysis, fluid properties, kinematics and dynamics of fluid flow, friction, boundary conditions, piping calculations, energy transfer by conduction, convection and radiation, and heat exchanger design. ME 214 or ; PHY 133 or ; MTE 207 or ; C- or better in CHE 202 or ; and CHE major or MTE minor. CHE 3221L. Lecture 3 hours lecture/discussion Graded Only May be taken only once Major Course",4.0,Chemical Engineering;Heat Transfer,technical_skills-1;engineering_capabilities-2,"{""chemical engineering"": 1, ""heat transfer"": 1}"
CHE 3040 - Kinetics & Reactor Design (3),"Chemical reaction equilibria. Equilibrium constant and the standard Gibbs free energy of reaction. Product distributions in single and multiple reactions. Mole balances. Levenspiel plots. Homogeneous and heterogeneous reaction kinetics for both chemical and materials engineering systems. Analysis of kinetic data. Reactor design, including batch, continuous-stirred tank flow, packed-bed, and plug flow reactors. Isothermal and non-isothermal reactor design. CHE 302 or ; and CHM 201, CHM 314, , or . Lecture Graded Only May be taken only once Major Course",2.5,Materials Engineering,engineering_capabilities-2,"{""materials engineering"": 1}"
CHE 3031 - Chemical Engineering Thermodynamics II (2),"Solution thermodynamics. Vapor-liquid phase equilibria of ideal and non-ideal solutions. Definition and applications of fugacity, activity, and activity coefficient. Equation of state calculation of mixture properties. Activity coefficient models: van Laar, Wilson, and NRTL models. Gibbs free energy changes of mixing and phase changes. Distillation and multi-component flash process calculations. CHE 302 or . Lecture Graded Only May be taken only once Major Course",2.5,Chemical Engineering,engineering_capabilities-2,"{""chemical engineering"": 1}"
CHE 3021 - Chemical Engineering Thermodynamics I (3),"Energy and its transformations; conversion of heat to work; first and second law analyses; property relationships; equations of state; equilibrium at minimum Gibbs free energy, Clausius-Clapeyron equation, vapor-liquid phase equilibria for pure fluids and mixtures of ideal solutions; thermodynamics of mixtures; partial molar properties and excess Gibbs free energy. or MTE 207; , MAT 224, or MAT 216; or PHY 133; C- or better in or CHE 202; and CHE major or MTE minor. Lecture Graded Only May be taken only once Major Course",2.5,Chemical Engineering,engineering_capabilities-2,"{""chemical engineering"": 1}"
CHE 2851 - Applied Mathematics in Chemical and Materials Engineering (2),"A study in the application of basic linear algebra, derivative, and integral concepts to solve chemical and materials engineering problems. Use of first-order ordinary differential equations to solve transient materials and energy balances. Use of MATLAB to solve set of non-linear algebraic equations and set of ordinary differential equations. Chemical Engineering major; MAT 215, MAT 216, or ; and C- or better in CHE 201 or . . Lecture Graded Only May be taken only once Major Course",3.5,Chemical Engineering;Materials Engineering,engineering_capabilities-2,"{""chemical engineering"": 1, ""materials engineering"": 2}"
CHE 2301 - Process and Automation (2),"Description of control systems, analysis and design objectives, the design process. Modeling in the frequency and time domain. Characteristics of control systems time response. Fundamental operating principles of circuit elements such as resistors, capacitors, and inductors; model the signals produced by these sensors; and analyze the circuits and systems used to amplify and process of analog and digital signals. Concepts will be reinforced with the use of laboratory exercises and computer simulation which include projects the using of software such as MATLAB, Simulink, or LabVIEW for analysis and design of control systems.",3.0,Control Systems;Automation,technical_skills-1,"{""control systems"": 3, ""automation"": 1}"
CHE 2301L - Process and Automation Laboratory (1),"Description of control systems, analysis and design objectives, the design process. Modeling in the frequency and time domain. Characteristics of control systems time response. Fundamental operating principles of circuit elements such as resistors, capacitors, and inductors; model the signals produced by these sensors; and analyze the circuits and systems used to amplify and process of analog and digital signals. Concepts will be reinforced with the use of laboratory exercises and computer simulation which include projects the using of software such as MATLAB, Simulink, or LabVIEW for analysis and design of control systems. MAT 215 or ; CHE 201, , IME 113L, or ; and C- or better in PHY 133 or . Laboratory Graded Only May be taken only once Major Course, Service Course",3.0,Control Systems;Automation,technical_skills-1,"{""control systems"": 3, ""automation"": 1}"
CHE 2021 - Material and Energy Balances II (2),"Analysis of single and multiple phase systems for chemical and materials engineering systems. Energy balances for both nonreactive and reactive systems. Material and energy balance analysis of transient processes. Material balance analysis of common types of reactors. C- or better in CHE 201 or CHE 2011, and C- or better in MAT 215 or MAT 2140. Lecture Graded Only May be taken only once Major Required Course",2.5,Materials Engineering,engineering_capabilities-2,"{""materials engineering"": 1}"
CHE 2011 - Material and Energy Balances I (2),"Material balances for physical and chemical processes. Use of process flow diagrams for plant mass balance calculations. Solving multi-component mass balance, simple and multiple mixing or separation problems, and chemical reaction problems including recycle and equilibrium. Energy balances for non-reactive processes. Chemical Engineering major; C- or better in CHM 121 and CHM 122, or ; and C- or better in MAT 115 or . Lecture Graded Only May be taken only once Major Course",2.5,Chemical Engineering,engineering_capabilities-2,"{""chemical engineering"": 1}"
CHE 1430L - Introduction to Chemical and Materials Engineering Experiments Laboratory (1),Introduction to the use of instrumentation to monitor Chemical and Materials Engineering processes. Measurement of the properties of materials. Introduction to design of experiments. GE Area A2; and C- or better in and . Laboratory Graded Only May be taken only once Non-Major/Non-Service Course,3.0,Materials Engineering,engineering_capabilities-2,"{""materials engineering"": 2}"
CHE 1421L - Chemical and Materials Engineering Analysis Laboratory (1),"Data analysis and experimental design using statistical concepts and techniques applied to chemical and materials engineering systems. Analysis of plant and laboratory data. Multiple regression. Correlations and significance of correlations. Analysis of variance. Introduction to statistical process control. C- or better in CHE 131 or , and CHE 141L or . CHE 1321. Laboratory Graded Only May be taken only once Major Required Course",4.5,Process Control;Materials Engineering,technical_skills-1;engineering_capabilities-2,"{""materials engineering"": 2, ""process control"": 1}"
CHE 1411L - Introduction to Chemical Engineering Laboratory (1),"Professions of Chemical and Materials (CME) engineering. Use of computer tools, Excel and MATLAB, to solve engineering problems. Process variables and basic techniques of material balance. MAT 105, MAT 112, , , MAT 1140, MAT 1150, MAT 2140, or MAT 2240. CHE 1311. Laboratory Graded Only May be taken only once Major Required Course",2.5,Chemical Engineering,engineering_capabilities-2,"{""chemical engineering"": 1}"
CHE 1321 - Chemical and Materials Engineering Analysis (1),Data analysis and experimental design using statistical concepts and techniques applied to chemical and materials engineering systems. Analysis of plant and laboratory data. Multiple regression. Correlations and significance of correlations. Analysis of variance. Introduction to statistical process control. C- or better in / or C- or better in CHE 131/141L. CHE 1421L. Lecture Graded Only May be taken only once Major Required Course,4.5,Process Control;Materials Engineering,technical_skills-1;engineering_capabilities-2,"{""materials engineering"": 2, ""process control"": 1}"
CHE 1311 - Introduction to Chemical Engineering (1),"Introduction to the professions of chemical and materials engineering. Use of computer tools, Excel and MATLAB, to solve engineering problems. Process variables and basic techniques of material balance. MAT 105, MAT 112, , . CHE 1411L. Lecture Graded Only May be taken only once Major Required Course",3.0,Chemical Engineering;Materials Engineering,engineering_capabilities-2,"{""chemical engineering"": 1, ""materials engineering"": 1}"
CS 4800 - Software Engineering (3),"Models of the software development process and metrics. Software requirements and specifications. Methodologies, tools and environments. Human-computer interaction. Software architecture, design and implementation techniques. Project management. Cost estimation. Testing and validation. Secure software development life cycle and common software security issues. Automated build, deployment and continuous integration. Maintenance and evolution. CS major, and C or better in CS 241 or . Lecture Graded Only May be taken only once Major Course",2.5,Project Management,engineering_capabilities-2,"{""project management"": 1}"
CS 3004 - Computer Science Supplementary Authorization Software Engineering for Teachers (2),"Models of the software development process and metrics. Software requirements and specifications. Methodologies, tools and environments. Human-computer interaction. Software architecture, design and implementation techniques. Testing and validation. Project management. Cost estimation. Automated build, deployment and continuous integration. Maintenance and evolution. C or better in CS 3001 and CS 3002, or consent of instructor. Lecture Graded Only May be taken only once Spring Service Course",2.5,Project Management,engineering_capabilities-2,"{""project management"": 1}"
CS 2600 - Systems Programming (3),"Fundamentals of C programming and Unix environment. File management, communications and process control. Regular expressions. Unix system calls, concurrent and socket programming. CS major and C or better in or . Lecture Graded Only May be taken only once Major Required Course",1.5,Process Control,technical_skills-1,"{""process control"": 1}"
ECE 4318 - Software Engineering (3),"Software requirements and specification, project management, modeling using UML, Petri-net and regular expression modeling, Software testing, Software metrics and measures, Risk and configuration management. ECE Major; and or ECE 304. Lecture Graded Only May be taken only once Major Course",2.5,Project Management,engineering_capabilities-2,"{""project management"": 1}"
EDD 7390 - Leadership in Postsecondary Strategic Planning and Resource Allocation (3),"Leading institutions presents challenges for educational leaders who must balance the needs of changing student demographics with limited financial resources. Examination of resource allocation and strategic planning theories, models and practices in education that foster equity across postsecondary institutions. Identification of persistent challenges facing college students and how institutional leaders can meet the needs of their students. Discussion of challenges and promising practices of human and resource management across postsecondary settings. Admission into the Doctoral Program. Seminar Graded Only May be taken only once Major Course",1.5,Resource Management,technical_skills-1,"{""resource management"": 1}"
EDU 5205 - Secondary Curriculum and Methods (3),"Principles and methodology of teaching in a content area in the secondary schools including instructional design, material selection, student assessment, and the development of state-adopted academic content standard based lesson plans. May include 10 hours of fieldwork. Admitted into Single Subject Credential; or TED 406; and , or TED 405 and TED 407. Seminar Graded Only May be taken multiple times 1 Total credit limited to 6 units, with a maximum of 3 units per semester. Major Course",1.5,Material Selection,technical_skills-1,"{""material selection"": 1}"
EDU 5110 - Theory and Practice in Mathematics Education (3),"Principles and methodology of teaching mathematics in the elementary school including instructional design, material selection, and student assessment with an emphasis on problem solving. Fieldwork: May include a maximum 10 hours of field experience. Admitted to Multiple Subject Credential; or TED 406; , or TED 405 and TED 407; and and TED 443. Seminar Graded Only May be taken multiple times 1 Total credit limited to 6 units, with a maximum of 3 units per semester. Major Course",1.5,Material Selection,technical_skills-1,"{""material selection"": 1}"
EC 6631 - Advanced Natural Resource Economics (3),"Advanced topics in resource economic analysis. Theories of renewable resources exhaustible resource usage. Policy efforts to guide optimal utilization of resources. Multiple use, intertemporal consistency issues in resource management. Quantitative models of resource demand, supply and scarcity. or EC 550. Lecture Graded Only May be taken only once Major Course",1.5,Resource Management,technical_skills-1,"{""resource management"": 1}"
ECE 4300 - Computer Architecture (3),"RISC architecture instruction sets, design of single cycle and pipelined RISC CPUs, performance evaluation, memory hierarchy and cache organization ECE Major; or ECE 341; or ECE 341L; or ECE 205; and or ECE 205L. Lecture Graded Only May be taken only once Major Course",3.5,Pipeline,delivery_and_storage-3,"{""pipeline"": 1}"
ECE 3810 - Introduction to Power Engineering (3),"Basic principles of power engineering with an emphasis on magnetics, transformers, and rotating AC and DC machines. Magnetic material characteristics and steady-state operational circuit models, as they apply to transformers and electrical machines. Power generation with synchronous and doubly-excited induction machines. Per-unit computations in power systems. ECE Major; and or ECE 209. Lecture Graded Only May be taken only once Major Course",3.5,Power Generation,use-3,"{""power generation"": 1}"
ECE 3709L - Control Systems Engineering Laboratory (1),Control system design assignments based upon the coursework of ECE 3709 involving basic LabView programming skills. ECE Major. . Laboratory Graded Only May be taken only once Major Course,4.0,Systems Engineering;Control Systems,technical_skills-1;engineering_capabilities-2,"{""systems engineering"": 1, ""control systems"": 1}"
ECE 3709 - Control Systems Engineering (3),"System modeling and performance specifications of dynamic systems. Design and analysis of linear time invariant feedback control systems via root locus and frequency response compensation techniques. ECE Major, or ECE 209, and or MAT 224. Lecture 3 hours lectures/problem-solving. Graded Only May be taken only once Major Course",4.5,Systems Engineering;Control Systems,technical_skills-1;engineering_capabilities-2,"{""systems engineering"": 1, ""control systems"": 2}"
ECE 3201 - Instrumentation Systems (3),"Components of Instrumentation Systems. Typical power supplies and signal conditioners. A/D and D/A converters. Sensors for various parameters. Error analysis, readouts, recorders and actuators, piping and instrumentation diagrams (PandID). ECE Major; , ECE 220, or ECE 299; and or PHY 133. Lecture Graded Only May be taken only once Major Course",2.5,Piping and Instrumentation Diagram,engineering_capabilities-2,"{""piping and instrumentation diagram"": 1}"
EMM 5900L - Project Management for Instructional Design Laboratory (1),"EMM 5900 The skills and knowledge required for successful initiation, planning, and completion of complex instructional design projects in school and business settings. Bridging practical application principles with current theories and concepts by managing real world real projects. . Laboratory Graded Only May be taken only once Major Course",2.5,Project Management,engineering_capabilities-2,"{""project management"": 1}"
EMM 5900 - Project Management for Instructional Design (2),"The skills and knowledge required for successful initiation, planning, and completion of complex instructional design projects in school and business settings. Bridging practical application principles with current theories and concepts by managing real world real projects. . Lecture Graded Only May be taken only once Major Course",2.5,Project Management,engineering_capabilities-2,"{""project management"": 1}"
EBZ 3030 - Customer Relationship Management and Business Analytics (3),"Management of customer relationship starting from acquisition, to development, retention, and win-back of customers. Applications under both Business-to-Business (B2B) and Business-to-Consumer (B2C) market settings, and CRM-Customer Relationship Management-implementation and evaluation with benchmarking and financial metrics. Based on the key CRM processes, including sales automation, marketing automation, and service automation. Understand customers by using CRM analytics tools. TOM 301 or ; and CIS 310 or . Lecture Graded Only May be taken only once Major Course",2.5,Automation,technical_skills-1,"{""automation"": 3}"
CE 5631 - Transportation Systems Design and Operation (3),"CE 4631 Introduction to traffic control systems. Types of traffic control methods. Warrants for placement of various intersection controls. Selection and placement of traffic control equipment. Signal system design and preparation of signal plans and specifications. Signal timing methods. Analysis of signalized intersection capacity and performance. Ramp metering. Graduate Standing, undergraduate course in transportation engineering, and transportation engineering lab or equivalent. Lecture 3 hours lecture/discussion Graded Only May be taken only once Major Course",1.5,Control Systems,technical_skills-1,"{""control systems"": 1}"
CE 5480 - Geotechnical Earthquake Engineering (3),"Introduction to seismology and earthquakes. Seismic hazard analysis. Wave propagation. Dynamic soil properties. Ground response analysis, local site effects, and design ground motions. Soil liquefaction. Seismic slope stability analysis. Seismic design of retaining walls. Remediation of seismic hazards. Graduate Standing, undergraduate course in geotechnical engineering, and geotechnical engineering lab or equivalent. Lecture 3 hours lecture/discussion Graded Only May be taken only once Major Course",3.5,Liquefaction,delivery_and_storage-3,"{""liquefaction"": 1}"
CE 5451 - Pavement Design and Construction (3),"CE 4451 Fundamental principles of structural pavement design and common design methods: AASHTO, Caltrans, Asphalt Institute and Portland Cement Association. Typical highway construction practices and activities. Laboratory testing of highway materials and quality assurance during construction are also discussed. Graduate Standing, undergraduate course in geotechnical engineering, and engineering materials or equivalent. Lecture 3 hours lecture/discussion Graded Only May be taken only once Major Course",1.5,Quality Assurance,technical_skills-1,"{""quality assurance"": 1}"
CE 5310 - GIS Applications in Civil Engineering (3),"Introduction to fundamental concepts and techniques of geographic information systems (GIS). GIS applications in transportation, environmental assessment, water resources management, geoenvironmental analyses and other areas in civil engineering. Graduate Standing. Lecture 3 hours lecture/discussion Graded Only May be taken only once Major Course",2.5,Geographic Information Systems,engineering_capabilities-2,"{""geographic information systems"": 1}"
