title,description,source,relevance_score,matched_keywords,matched_groups,keyword_frequencies
ENGN 1410. Physical Chemistry of Solids,"Application of physical chemistry and solid state chemistry to the structure and properties of engineering solids as used in solid state devices, ceramics, and metallurgy. Equilibrium and free energy of heterogeneous systems, thermodynamics of solutions, chemical kinetics, diffusion, catalysis and corrosion, solid state transformations. Case studies taken from industrial practice. Prerequisites: ENGN 0410 , 0720 .",https://bulletin.brown.edu/engineering/,5.0,Corrosion;Catalysis,production-3;technical_skills-1,"{""catalysis"": 1, ""corrosion"": 1}"
ENGN 1420. Kinetics Processes in Materials Science and Engineering,"This course introduces the basic principles and formulations that describe kinetic processes in materials science and engineering. These are divided into the following principle types of mechanisms: solid state diffusion, reactions at surfaces and interfaces, and phase transformations. The final section of the course applies these principles to several relevant materials processing systems. Prerequisites: ENGN 0410 , 0720 , 1410 or equivalent.",https://bulletin.brown.edu/engineering/,3.0,Materials Science,engineering_capabilities-2,"{""materials science"": 2}"
ENGN 1450. Properties and Processing of Electronic Materials,"Focus on fundamental properties, processing, and characterization of electronic materials for microelectronic, large area, and thin film device applications. Processing Si into modern integrated circuits, e.g., VLSI, USLI, will be described in terms of materials science of unit processes (oxidation, lithography, diffusion, ion implantation, thin film deposition) used in device fabrication. Review relationship between properties of different materials classes (metals, semiconductors, insulators) and band structure. Concepts used to explain the operation of a p-n junction and simple MOS structures. Laboratory will focus on depositing materials via vapor phase synthesis methods and measuring fundamental electronic properties of materials using transport measurements.",https://bulletin.brown.edu/engineering/,2.5,Materials Science,engineering_capabilities-2,"{""materials science"": 1}"
ENGN 1490. Biomaterials,"Biomaterials science, the study of the application of materials to problems in biology and medicine, is characterized by medical needs, basic research, and advanced technological development. Topics covered in this course include materials used in bone and joint replacement, the cardiovascular system, artificial organs, skin and nerve regeneration, implantable electrodes and electronic devices, drug delivery, and ophthalmology.",https://bulletin.brown.edu/engineering/,2.5,Materials Science,engineering_capabilities-2,"{""materials science"": 1}"
ENGN 1600. Design and Implementation of Digital Integrated Circuits,"This course will cover digital design and implementation concepts required for successful tape-out of integrated circuits. The first part covers the fundamentals of Very Large-Scale Integration (VLSI) design, including transistor analysis, standard cell layout, and cell characterization techniques. The second part covers use of design automation tools to complete a full design to tape-out. In the second part, hardware design using Verilog will be first discussed, and then will follow with the use of techniques and tools: logic synthesis, circuit timing and power, and placement and routing. The class will feature a number of labs and a large design project.",https://bulletin.brown.edu/engineering/,1.5,Automation,technical_skills-1,"{""automation"": 1}"
ENGN 1640. Design of Computing Systems,"This course introduces the main concepts and techniques for designing computing systems. Topics covered include assembly language, instruction set design, pipelining, superscalar and VLIW processor design, memory subsystem design, and I/O interfacing. Laboratory topics include programmable logic devices, hardware definition languages, and implementation of a bootable version of the pipelined MIPS processor. Laboratory emphasizes design optimizations with respect to speed and design area. Prerequisite: ENGN 1630 or passing of a quiz on basic digital logic concepts, or instructor permission.",https://bulletin.brown.edu/engineering/,3.5,Pipeline,delivery_and_storage-3,"{""pipeline"": 1}"
ENGN 1705. Sustainable Energy: Science and Technology,"The energy transition from fossil fuels to renewable sources may be the defining technological issue of the coming decades. This class covers the fundamental science and technology of energy technologies, focusing on emerging energy resources. Students will learn the fundamental thermodynamics of energy conversions as well as the tools to analyze energy technologies. The course will cover the basic science of the greenhouse-gas induced climate change, and will analyze energy technologies in terms of the trade-offs involved in emissions, cost, scalability, land use, and resource ability.",https://bulletin.brown.edu/engineering/,4.5,Energy Transition,sustainability_and_policy-4,"{""energy transition"": 1}"
ENGN 1710. Principles of Heat Transfer,"This course explores the transfer of energy as heat. It starts with basic heat transfer problems involving thermal conduction, convection, and radiation. The steady heat transfer through composite walls and heat dissipated from extended surfaces (such as fins) are examined. Transient heat transfer and heat transfer between solids and fluids will be investigated, considering natural and forced convection heat transfer. Various heat exchanger types will be evaluated, however concentric double-pipe heat exchangers analyzed in detail. Radiant heat transfer, surface emissive power, real surface radiation; view factors for black and gray surfaces will be studied. The course includes two hands-on laboratory experiments which supplement the material covered in the class meetings. The course also includes recitation sessions devoted to using COMSOL. The course ends with a design team competition focused on the most ""efficient and elegant"" coffee cup. Prerequisite: ENGN 0720",https://bulletin.brown.edu/engineering/,4.5,Heat Transfer,technical_skills-1,"{""heat transfer"": 7}"
ENGN 1720. Design of Thermal Engines,"Students will work in groups on semester long engine design projects. Projects are to incorporate: formulation of design problem statements and specifications, consideration of alternative solutions, detailed design descriptions, development and use of design methodology, development of student creativity and use of acquired engineering skills, while including realistic constraints such as economic factors, safety, reliability, ethics, social impact, etc. Lectures, laboratory, and computer-aided design projects with oral and written reports. Lectures to cover: thermodynamics, heat transfer, fluid dynamics, kinematics/dynamics, lubrication, combustion, fuels, and pollution of thermal engines. Prerequisites: ENGN 0720 and 0810 .",https://bulletin.brown.edu/engineering/,4.0,Combustion;Heat Transfer,technical_skills-1;engineering_capabilities-2,"{""combustion"": 1, ""heat transfer"": 1}"
ENGN 1800. Social Impact of Emerging Technologies: The Role of Scientists and Engineers,"The role of engineering sciences in an ever-changing technology-driven world. Students will develop basic working knowledge of selected contemporary technologies that help identify and forecast future prospects while discerning future disruptions. Emphasis on the importance of ethical and social responsibilities that technologists must shoulder in answering societal challenges and contributing to policy making and corporate leadership. How do we create beneficial technologies yet anticipate their potential social costs, such as workforce automation or overdependence on the internet? Will we give up brains as our last private space? Who will control the data / technology ecosystem that influences our decisions?",https://bulletin.brown.edu/engineering/,1.5,Automation,technical_skills-1,"{""automation"": 1}"
ENGN 1920. Sustainable Energy: Science and Technology,"The energy transition from fossil fuels to renewable sources may be the defining technological issue of the coming decades. This class covers the fundamental science and technology of energy technologies, focusing on emerging energy resources. Students will learn the fundamental thermodynamics of energy conversions as well as the tools to analyze energy technologies. The course will cover the basic science of the greenhouse-gas induced climate change, and will analyze energy technologies in terms of the trade-offs involved in emissions, cost, scalability, land use, and resource ability.",https://bulletin.brown.edu/engineering/,4.5,Energy Transition,sustainability_and_policy-4,"{""energy transition"": 1}"
ENGN 1930U. Renewable Energy Technologies,"Renewable Energy Technology examines energy conversion, transport, and storage with the goal of devising courses of action that transform the current state of energy use into one that relies more fully on renewable resources and efficient processes. The course will give priority to photovoltaics, wind, and hydro conversion technologies and to the electrical grid for energy transport. From year-to-year other topics will be explored based on the wishes of the participants. Research, discussion, projects, and presentations will be the primary learning methods. The engineering core and thermodynamics are suggested preparation for this course.",https://bulletin.brown.edu/engineering/,5.0,Renewable Energy,sustainability_and_policy-4,"{""renewable energy"": 2}"
ENGN 1931K. Cell-Material Interactions in Tissue Engineering,"Students study how materials are used in cell-based biological applications focusing on engineered tissues and translational applications. Hybrid materials can be designed to elicit specific cellular interactions, including cell adhesion, mechanosensing, biochemical signaling, and electrical conduction. Primary scientific literature provides examples of design principles as applied to natural and synthetic materials in cell-based assays, engineered tissues, and in vivo implantation. Students participate in class discussions of scientific literature, lead discussion through oral presentation and group engagement, and write literature summaries including a final project (either a primary research manuscript or literature review). Pre Requisites: Recommended: Physiology/Cell & Molecular Biology, Biomaterials/Materials Science.",https://bulletin.brown.edu/engineering/,2.5,Materials Science,engineering_capabilities-2,"{""materials science"": 1}"
ENGN 1931M. Industrial Machine Vision,"This course will offer advanced undergraduate and master's students a practical introduction to industrial applications of machine vision and will provide theoretical, hands-­on experience with automation and visual inspection technologies. Computer Vision, the automated analysis of images and video sequences, began as a research subject within computer science and engineering and has become an accepted technology with industrial applications. Current industry applications of machine vision: Electronics, metal, automotive, wood, plastics, paper, textiles, films, food manufacturing, biomedicine. Common functions: Recognition of features or components, guidance of assembly, robotic arms or vehicles, welding, dispensing; and inspection, measurement, detection of defects.",https://bulletin.brown.edu/engineering/,5.0,Welding;Automation,technical_skills-1;delivery_and_storage-3,"{""welding"": 1, ""automation"": 1}"
ENGN 1931P. Energy and the Environment,"This course explores all the energy forms, but will focus on energy sources from which the majority of “useful” energy originates at the present time. Basic heat transfer problems related to energy efficiency are presented. Rankine and Brayton power cycles are introduced. Cycle modifications supporting energy efficiency are explored. Carbon footprint calculations are illustrated. Traditional and cutting-edge technologies for carbon capture and storage presented. Emissions such as SOx, NOx, and PM and their capture technologies investigated. The Earth climate model examined. The course features three 1-page long scientific summary writings and the tour to the Manchester Street Power Station.",https://bulletin.brown.edu/engineering/,5.5,Heat Transfer;Carbon Capture;Carbon Capture and Storage,production-3;technical_skills-1,"{""carbon capture and storage"": 1, ""carbon capture"": 1, ""heat transfer"": 1}"
ENGN 1931R. The Chemistry of Environmental Pollution,"This course examines fundamental chemical aspects of pollutants and methods used to address pollution. We will consider pollution in air, water and soil media, and how pollution arises. Basic aspects of pollutant chemical partitioning will be explored. Examples of site investigation and the chemical tools used for that purpose will be discussed, along with risk assessment. Different ways of cleaning up contaminated sites will be examined, along with considering how mitigation and natural processes might represent options for addressing the particular pollution situation. Prerequisites are ( MATH 0100 , 0170 , 0180 , 0200 , 0350 or 0190 ) and ( CHEM 0100 or 0330 ).",https://bulletin.brown.edu/engineering/,1.5,Risk Assessment,technical_skills-1,"{""risk assessment"": 1}"
ENGN 1931X. Instrumentation for Research: A Biomaterials/Materials Project Laboratory,"This course is designed to prepare students for research in biomaterials/materials science by focusing on a project that yields a testable product/device. Advanced equipment/instrumentation will be used to fabricate and evaluate materials required for each project and to test the performance of the product/device that uses these materials. Example projects that illustrate the course plan include building a microfluidic-based medical sensor or fabricating a polymer-based battery. These examples require materials synthesis (polymerization or hydrothermal), materials characterization (SEM, X-ray diffraction), device fabrication (microfabrication, assembly under inert/sterile atmosphere), and product testing (biological assays, electrochemical methods). Student interests will determine other projects. Completion of Laboratory Safety and Hazardous Waste Training offered by EHS.",https://bulletin.brown.edu/engineering/,3.0,Materials Science;Electrochemical,engineering_capabilities-2,"{""materials science"": 1, ""electrochemical"": 1}"
ENGN 1931Y. Control Systems Engineering,"Control Systems is an Engineering discipline that applies control theory to analyze and design systems with desired response behavior. The objective of this course is to introduce the student to the topic of feedback control design with applications on many diverse systems. The course will cover the fundamentals of classical control theory such as modeling, simulation, stability, controller design and digital implementation. It will also address basic aspects of state-space and modern control theory. The course is open to all Engineering majors and will make use of existing simulation packages such as Matlab/Simulink.",https://bulletin.brown.edu/engineering/,4.5,Systems Engineering;Control Systems,technical_skills-1;engineering_capabilities-2,"{""systems engineering"": 1, ""control systems"": 2}"
"ENGN 1931Z. Interfaces, Information and Automation","Laboratory-intensive course to help students develop and implement simple computer programs in Python to control, query, and integrate discrete (traditionally isolated) systems, ranging from automobiles to websites. Assignments will provide hands-on practice using programmatic interfaces to control both physical and virtual systems. Topics include physical interfaces and communication protocols (e.g., GPIB, RS-232, USB) as well as accessing online resources (e.g., SOAP and RESTful web services) and building hybrid systems for data acquisition and analysis. Formal programming experience is not required, but familiarity with either MatLab or Python (at the level of CSCI 0040 or higher) would be very helpful.",https://bulletin.brown.edu/engineering/,1.5,Automation,technical_skills-1,"{""automation"": 1}"
ENGN 1932P. Sustainable Energy: Science and Technology,"The energy transition from fossil fuels to renewable sources may be the defining technological issue of the coming decades. This class covers the fundamental science and technology of energy technologies, focusing on emerging energy resources. Students will learn the fundamental thermodynamics of energy conversions as well as the tools to analyze energy technologies. The course will cover the basic science of the greenhouse-gas induced climate change, and will analyze energy technologies in terms of the trade-offs involved in emissions, cost, scalability, land use, and resource ability.",https://bulletin.brown.edu/engineering/,4.5,Energy Transition,sustainability_and_policy-4,"{""energy transition"": 1}"
ENGN 2002. Climate Solutions: Science and Society,"This course is designed to introduce you to the most recent science of climate change and its impacts in the coming decades, and will focus on solutions (technical, social, political, and economic) that are being or could be implemented to avert the worst consequences of this human caused problem. The course discusses the scientific foundation for a goal of net zero greenhouse gas emissions, and then explores how this might be achieved, and how different theories of change, equity and justice might lead to different conceptions of what an optimal solution might look like. The final deliverable asks your team to assess a climate solution in your industry and the barriers to, and opportunities for, more rapid implementation of that solution.",https://bulletin.brown.edu/engineering/,4.5,Greenhouse Gas Emissions,sustainability_and_policy-4,"{""greenhouse gas emissions"": 1}"
EMBA 2310. Climate Change at the Intersection of Business and Society (change from Natural Collections),"This course is designed to introduce you to the most recent science of climate change and its impacts in the coming decades, allowing us to see mitigation of climate change and adaptation to its impacts not only as moral imperatives but also as an opportunity for commercial actors in the coming years and decades. The course discusses the scientific foundation for a goal of net zero greenhouse gas emissions, and then explores how that is operationalized in businesses, in investing, and by governments. The final deliverable asks you to explore emissions reductions or adaptation strategies in your own company.",https://bulletin.brown.edu/masters-professional/professional-studies/,4.5,Greenhouse Gas Emissions,sustainability_and_policy-4,"{""greenhouse gas emissions"": 1}"
BIOL 0940G. Antibiotic Drug Discovery: Identifying Novel Soil Microbes to Combat Antibiotic Resistance,"This is a Course-based Undergraduate Research Experience (CURE) class that will provide students with the chance to propose, design and conduct their own research projects. Antibiotic resistance is a major global health threat. Pharmaceutical companies are less likely to fund research and development of new antibiotics due to their relative low profitability. As bacteria become more resistant to antibiotics, it is critical that we have a robust pipeline ready to combat these pathogens. The main focus of the course will be for students to discover new antibiotics in soil bacteria that can be used to treat infectious disease. Please NOTE: This course carries Biology concentration credit for the laboratory component, and also can be used for 1 semester of research towards the Biology ScB.",https://bulletin.brown.edu/biologyandmedicine/biology-undergraduate/,3.5,Pipeline,delivery_and_storage-3,"{""pipeline"": 1}"
BIOL 1140. Tissue Engineering,"Tissue engineering is an interdisciplinary field that incorporates progress in cellular and molecular biology, materials science, and engineering, to advance the goal of replacing or regenerating compromised tissue function. Using an integrative approach, we will examine tissue design and development, manipulation of the tissue microenvironment, and current strategies for functional reconstruction of injured tissues. Expected: CHEM 0330 , plus BIOL 0500 or 0800 . Enrollment limited to 20. Instructor permission required.",https://bulletin.brown.edu/biologyandmedicine/biology-undergraduate/,2.5,Materials Science,engineering_capabilities-2,"{""materials science"": 1}"
ENGN 2125. Engineering Management + Decision Making,"The primary objective of the course is to train students on tools, skills, and behaviors required for effective management of complex engineering, research, and business development projects. Although the course will be framed in the context of early-stage technology companies, the skills and principles will be applicable to businesses of any size and maturity. The course is organized around three actionable themes: project management, team management, and decision making.",https://bulletin.brown.edu/engineering/,3.0,Project Management;Engineering Management,engineering_capabilities-2,"{""project management"": 1, ""engineering management"": 1}"
ENGN 2400. Electron Microscopy in Materials Science,"Theory of electron optics and principles of transmission electron microscopy, including dynamical theory of electron diffraction and image contrast. Applications to materials analysis including defect, boundary, and phase analysis. Analytical electron microscopy including convergent beam diffraction, energy dispersive x-ray analysis, and energy loss spectroscopy. Intensive laboratory exercises.",https://bulletin.brown.edu/engineering/,2.5,Materials Science,engineering_capabilities-2,"{""materials science"": 1}"
ENGN 2420. Kinetic Processes and Mechanisms in Materials Science,"Continuum and atomistic descriptions of diffusion in solids. Reactions involving surfaces and interfaces, including evaporation, adsorption, grain growth, and coarsening. Phase transformation kinetics, including nucleation, growth, solidification, spinodal decomposition, and martensitic transformations. Analysis of systems with multiple kinetic mechanisms (typical examples include oxidation, crystal growth, and sintering). Prerequisite: background in basic thermodynamics. Recommended: ENGN 1410 or 2410 or equivalent.",https://bulletin.brown.edu/engineering/,2.5,Materials Science,engineering_capabilities-2,"{""materials science"": 1}"
ENGN 2440. Strength of Solids,"Mechanical behavior of solids as interpreted through atomistic mechanisms. Theory and characteristics of dislocations in continuous and crystalline media. Intrinsic and extrinsic stacking faults, extended dislocations, point defects, nodes and networks, disclinations, crystal boundaries. Applications of dislocation theory to single and polycrystal plasticity, work-hardening, stress-corrosion, creep, fatigue, hardening mechanisms, etc.",https://bulletin.brown.edu/engineering/,1.5,Corrosion,technical_skills-1,"{""corrosion"": 1}"
ENGN 2460. Electronic and Magnetic Materials Design,"This course combines materials chemistry and condensed matter physics to understand the design of nanoscale electronic and magnetic devices. This course integrates fundamental atomistic understanding, heterostructure design, and macroscopic properties. We will learn and apply knowledge of chemistry, crystallography, defects, deposition, and device physics to delve into thin film materials used in fuel cells, solid state sensors, quantum information science, logic and memory, and data storage. We will not only study examples used today, but also explore cutting-edge research on the frontier of these areas. Our goal is to better understand the functional materials and heterostructures used in solid states devices. The course is intended to support graduate students conducting research in nanoscale devices.",https://bulletin.brown.edu/engineering/,3.5,Fuel Cell,use-3,"{""fuel cell"": 1}"
ENGN 2704. Predictive Analytics,"This course, which builds on the analytical skills developed in Descriptive Analytics, is a deep dive into the predictive analytics techniques that underpin strategic decision-making in contemporary business environments. Students will engage in event forecasting, participating in an in-class forecasting contest designed to put theory into practice. A key component of the course is exploration of Bayes’ Theorem, providing a probabilistic foundation for making informed predictions. The course covers time-series forecasting of business metrics and customer-level predictive modeling techniques, enabling students to anticipate customer behaviors and take action at scale. This work segues into calculating customer lifetime value, a vital metric for evaluating long-term business relationships and profitability, along with customer experience analytics. It incorporates the latest advances in generative AI, examining its application to data analytics and its potential to revolutionize the way businesses analyze, visualize, and forecast trends.",https://bulletin.brown.edu/engineering/,2.0,Predictive Analytics,technical_skills-1,"{""predictive analytics"": 2}"
