title,description,source,relevance_score,matched_keywords,matched_groups,keyword_frequencies
"UNIV 1005. Narratives of Racism: Lynchings, Miscarriages of Justice, and Internment Camps in America","In this course, we will study narrative accounts of 20th-century American incidents in which racism led to the persecution of members of minority groups by means of lynchings, miscarriages of justice, or the placement of people in internment camps: the unjustly conducted trial and lynching of the Jewish factory manager Leo Frank accused of murdering a young girl in Georgia; the kidnapping and murder of African American adolescent Emmett Till in Mississippi; and the internment of Japanese descendants during World War II out of fear that they would aid America's enemy.",https://bulletin.brown.edu/universitycourses/,3.5,CCUS,production-3,"{""ccus"": 1}"
IAPA 1701A. Technology and Development,"A “smart” global order is currently being created, where information and communication technologies dominate public arenas and private lives. Much of the debates on new technologies have focused on the global North, yet the impact on the global South is equally significant. In this course, we will explore the history, present and possible futures of the use of technologies for transforming economic, social and political lives. The technologies discussed will range from the steam power leading to the first industrial revolution to today’s mobile phone technologies, workforce automation, as well as facial-recognition and other surveillance technologies.",https://bulletin.brown.edu/international-public-affairs/,1.5,Automation,technical_skills-1,"{""automation"": 1}"
IAPA 1701P. Global Megaprojects,"Megaprojects are costly, complicated, risky, and laborious. They include power plants, pipelines, ports, and petrochemical complexes; take years—or even decades—to finish; and owe their successes and failures to social and organizational—and not merely technical—considerations. This class addresses the origins, design, management, and consequences of megaprojects in contemporary and historical perspective. Our goal is to learn not only about specific projects—like the Panama Canal, Tennessee Valley Authority, Trans-Amazon Highway, and Belt and Road Initiative being undertaken by China—but about theories and methods that will help us understand the origins and fates of large-scale organizations more generally.",https://bulletin.brown.edu/international-public-affairs/,3.5,Pipeline,delivery_and_storage-3,"{""pipeline"": 1}"
"IAPA 1701Y. Climate Change, Power, & Money","Fossil fuel energy made economic development possible, but now we’re cooking the planet. Some want to keep burning carbon; some want to halt capitalism itself; most are somewhere in between. This course is about the political economy of decarbonization. It begins by evaluating the state of affairs, how we became dependent on carbon, the current stakes, and the key actors and stakeholders. It then goes straight to debate the core problem of our future: What are the trade-offs that come with different decarbonization paths? The course then examines some of the most prominent solutions and challenges for rapid decarbonization. Throughout the course, we will pay special attention to - you guessed it - power and money. At the end of the day, those two forces make the world go round and will make or break decarbonization.",https://bulletin.brown.edu/international-public-affairs/,6.0,Decarbonization,sustainability_and_policy-4,"{""decarbonization"": 4}"
IAPA 1801G. Technology and Development,"With the most recent inventions, a “smart” global order is being created, where information and communication technologies (ICT) dominate public arenas and private lives. Most of the debates on new technologies still focus on the Global North, yet the impact on the Global South may be at least as significant. In this seminar, we will explore the history, present, and possible futures of the use of technologies for transforming economic, social and political lives. The technologies discussed will range from the steam power central to the 19th century industrial revolution to today’s mobile phone technologies, workforce automation, and facial-recognition technologies.",https://bulletin.brown.edu/international-public-affairs/,1.5,Automation,technical_skills-1,"{""automation"": 1}"
"IAPA 1805. Inequality, Sustainability, and Mobility in a Car-Clogged World AKA: Two Billion Cars","With the possible exception of the computer or antibiotics, the car is arguably the most significant invention of the last two centuries. It has fundamentally reshaped the environment, social landscapes, lives, and economies, and its impact will only increase as the global vehicle population doubles, as predicted, to two billion by the year 2030. This class will explore the immense social, political, health, and environmental consequences, as well as cultural and political economic explanations for the car population explosion. Alternative forms and futures for transit will be considered throughout the course.",https://bulletin.brown.edu/international-public-affairs/,6.0,Sustainability;Explosion,technical_skills-1;sustainability_and_policy-4,"{""sustainability"": 1, ""explosion"": 1}"
MPA 2231. Activating Change for Climate & Sustainability,"Taking the class as a metaphor of the outside world, we will explore and propose our own respective path(s) for climate policy while focusing on the class’s individual and collective willingness to act. While the topic of the class is climate policy, the primary material of our work will be yourself, as a participant of this collective effort.",https://bulletin.brown.edu/international-public-affairs/,5.5,Sustainability;Climate Policy,sustainability_and_policy-4,"{""sustainability"": 1, ""climate policy"": 2}"
"MPA 2601. Envisioning and Building Prosperous, Inclusive Communities","Great communities do not happen by accident. Great communities take vision, thoughtful planning, participation and an inclusive civic engagement plan. The top communities in our country engage diverse leaders, acknowledge the complex and inextricable tie between community and economic development, are accountable – measuring their progress, and are fiercely competitive. This course will focus on the planning, creation, and implementation of successful community development plans from across the country. Specific topics that will be covered include: Collective Impact, the utilization of data, the role of sustainability, health, education, art, transportation, and parks, evaluation methodology, communication, and working with local governments.",https://bulletin.brown.edu/international-public-affairs/,4.5,Sustainability,sustainability_and_policy-4,"{""sustainability"": 1}"
MPA 2604. The Corporation and Public Policy,"This course examines corporations as instruments of government policy and as significant policy setters in their own right. Rather than taking a fixed viewpoint about the proper location of executive authority, the course will examine the changing boundaries of private and public decision-making. Through selected readings paired with case studies, the course investigates a range of critical policy problems: the underlying purpose of corporate organization; climate change and environmental sustainability; consumer safety in the gig economy; labor standards in transnational supply chains; corporate responsibility and health in developing regions.",https://bulletin.brown.edu/international-public-affairs/,4.5,Sustainability,sustainability_and_policy-4,"{""sustainability"": 1}"
MPA 2710. GIS and Public Policy,"This seminar presents an introduction to the theory and practice of social science Geographic Information Systems (GIS) as applied to public policy analysis. We will cover a variety of topics, such as the geographical basis of policy issues, spatial mapping, and use of ArcGIS software to study a wide range of policy issues. The course will involve discussions, hands-on computer laboratory exercises, take-home problem sets and a Practical Exam. The goals of the class are: 1) learning how to use GIS software and techniques, 2) database development and editing 3) spatial modeling techniques, and 4) using GIS to study policy issues.",https://bulletin.brown.edu/international-public-affairs/,2.5,Geographic Information Systems,engineering_capabilities-2,"{""geographic information systems"": 1}"
MPA 2765. System Dynamics: Policy Analysis for a Complex World,"The course studies why so many public policy problems are challenging and often lead to disappointing results or outright failure. Students learn to conceptualize a social problem as a set of structures and policies that create dynamics and govern performance. The course introduces the tools of system dynamics for modeling and analyzing public policy. Using role playing games, simulation models, and management flight simulators, we develop insights essential to managing in a world characterized by dynamic complexity. Case studies include applications of system dynamics in healthcare, environmental policy, project management, and implementation of improvement programs.",https://bulletin.brown.edu/international-public-affairs/,2.5,Project Management,engineering_capabilities-2,"{""project management"": 1}"
BHDS 2110. Methods I: Linear and Generalized Linear Models,"This course offers a comprehensive foundation in statistical theory and the practical application of generalized linear models (GLM) for clinical and human health research. It will cover diverse applications of GLMs tailored to common outcomes found in health data, such as continuous, binary, count, and survival data. The curriculum spans from exploratory data analysis to model building, diagnostics, and predictive analytics, with an emphasis on applications of GLM theory for solving real-world data challenges. Case studies and examples will be drawn from various fields, including medical/pharmaceutical applications, public health, and social sciences. This course is specifically crafted for students enrolled in the online Master’s program who seek to gain both hands-on proficiency and a solid conceptual grasp of regression analysis principles.",https://bulletin.brown.edu/public-health/,1.5,Predictive Analytics,technical_skills-1,"{""predictive analytics"": 1}"
GPHP 2320. Evaluation of Public Health Programs,"This course will focus on how public health programs and interventions are evaluated. Students will learn about frequently used methods and planning tools as well as basic principles of budget and resource management to apply them to the development of an evaluation plan. Part of the evaluation is also assessing the impact of structural, socioeconomic, political, and organizational processes on the development, adaptation, implementation, and evaluation of public health programs and interventions.",https://bulletin.brown.edu/public-health/,1.5,Resource Management,technical_skills-1,"{""resource management"": 1}"
PHP 1070. Global Burden of Disease,"This is an advanced introduction to global public health, defining and critically examining key topics and concepts through an interdisciplinary lens. From historical efforts in mid-20th century international health assistance, to the early 21st century explosion of global health funding, to current efforts to decolonize global health and engage in more equitable global partnerships, this course examines major social and scientific developments. Readings, lectures, in-class discussions and small groups explore changes in the underlying causes of morbidity and mortality during global social, economic and health transitions, the biological and social ecology of global disease patterns, and efforts to improve health in under-resourced settings. Guest lecturers offer different perspectives on the global burden of disease. An in-depth research paper worth 40% of the final grade is the scholarly centerpiece of course; this is a rigorous semester-long project. There are two exams.",https://bulletin.brown.edu/public-health/,1.5,Explosion,technical_skills-1,"{""explosion"": 1}"
PHP 1560. Using R for Data Analysis,"This hands-on course teaches foundational skills in data analysis and programming using R. Students will learn to summarize and visualize data, implement statistical analyses, and produce reproducible reports with Quarto. Key topics include understanding the base data structures in R, simulating from probability distributions, conducting an exploratory data analysis, implementing hypothesis testing, and larger programming structures such as loops and functions. The course also focuses on writing clean, understandable, and modular code by employing good coding practices. Students will gain experience in designing code to build an end-to-end data analysis pipeline. This course is taught as a flipped course.",https://bulletin.brown.edu/public-health/,3.5,Pipeline,delivery_and_storage-3,"{""pipeline"": 1}"
PHP 1700. Current Topics in Environmental Health,"This course is designed to introduce students to the field of environmental health, and demonstrate how environmental health is integrated into various aspects of our lives, both directly and indirectly. Topics to be covered include: toxic metals, vector-borne disease, food safety, water quality, radiation, pesticides, air quality, hazardous waste, risk assessment, and the role of the community in environmental health. Several topics will be presented by guest speakers so that students can learn from the expertise of professionals in the field. Enrollment limited to 65.",https://bulletin.brown.edu/public-health/,2.0,Risk Assessment;Water Quality,technical_skills-1,"{""risk assessment"": 1, ""water quality"": 1}"
PHP 1730. Climate Risks and Health Solutions,"Climate risks are no longer theoretical. This course provides students with a broad overview of the health consequences of climate change resulting from changing temperatures, extreme weather, air pollution, and water quality. The course will introduce students to practical solutions that both reduce greenhouse gas emissions and improve human health. These solutions include energy efficiency and decarbonization in buildings, electrifying transportation, changing food production, and engagement with healthcare organizations. Students will be exposed to a range of practitioners working to implement solutions in a variety of sectors and will gain practical skills needed to support the development of regulations, policy, and programs. Assignments will give students experience developing written materials and practicing oral skills to engage in climate policy work. Note that enrollment is limited to 20 students.",https://bulletin.brown.edu/public-health/,7.0,Decarbonization;Water Quality;Climate Policy;Greenhouse Gas Emissions,technical_skills-1;sustainability_and_policy-4,"{""decarbonization"": 1, ""greenhouse gas emissions"": 1, ""climate policy"": 1, ""water quality"": 1}"
PHP 2030. Clinical Trials Methodology,"We will examine the modern clinical trial as a methodology for evaluating interventions related to treatment, rehabilitation, prevention and diagnosis. Topics include the history and rationale for clinical trials, ethical issues, study design, protocol development, sample size considerations, quality assurance, statistical analysis, systematic reviews and meta-analysis, and reporting of results. Extensively illustrated with examples from various fields of health care research. Recommended prerequisites: introductory epidemiology and statistics. Pre-requisites: ( PHP 2120 or PHP 2150 ) and either PHP 2508 , 2510 , or 2520 . Open to graduate students only.",https://bulletin.brown.edu/public-health/,1.5,Quality Assurance,technical_skills-1,"{""quality assurance"": 1}"
PHP 2130. Human Biology for Public Health,"This course provides basic principles of human biology and its applications to public health. Examples of biology topics include the cardiovascular system, endocrine system, immune system, nervous system, genetics, cancer, cardiovascular disease, HIV/AIDS, and depression. Examples of applied topics include strengths and weaknesses of using biomarkers, accuracy and precision of biological measures, quality assurance and quality control methods for using biomarkers for public health research. Mixed teaching methods are used, including small group discussions, problem-based learning and guest lectures. Prerequisite: PHP 2120 (may be taken concurrently) or instructor permission. Enrollment limited to 20 graduate students.",https://bulletin.brown.edu/public-health/,1.5,Quality Assurance,technical_skills-1,"{""quality assurance"": 1}"
"PHP 2400. The U.S. Health Care System: Case Studies in Financing, Delivery, Regulation and Public Health","Reviews the development of the health care delivery, financing and regulatory control systems in the U.S. and reviews the literature on the relationship between health system structure and the services used and health outcomes that populations experience. A case-study approach is used to understand the inter-relationship between financing, delivery and regulatory components of the health system and their implication for public health by drawing on epidemiological, economic, political and sociological principals. Prerequisites: Graduate standing or PHP 0310 and instructor permission.",https://bulletin.brown.edu/public-health/,1.5,Control Systems,technical_skills-1,"{""control systems"": 1}"
PHP 2727. Putting Research Into Practice with Implementation Science,"The objective of this course is for students to learn the principles of implementation science to ensure the successful translation of evidence-based research into practice. Building on the foundation of PHP 2074 : “Needs Analysis and Program Planning,” this course will teach students how to assess the results of interventions and address systematically identified impediments to sustainability and scalability. Students will also learn to use systems thinking tools and frameworks to determine the factors that promote or impede the adoption and sustainability of health-related interventions. This is a required AMPH course. This course is open to PhD students and residential two-year MPH program students. For two-year MPH students, PHP 2355 and PHP 2072 are the pre-requisite courses. Doctoral students will only be admitted with permission of the instructor.",https://bulletin.brown.edu/public-health/,5.0,Sustainability,sustainability_and_policy-4,"{""sustainability"": 2}"
BIOL 2010B. Introduction to Data Science in Molecular Biology,"In this course, second year PhD students in the Molecular Biology, Cell Biology, and Biochemistry Graduate Program (MCBGP) will learn about the basic methodologies to analyze and interpret omics datasets. This course combines lectures with hands-on workshops on data science applied to molecular research for the analysis of nucleic acids and proteins. Student will acquire knowledge of the data generated by modern molecular biology, and of the computational methods used to analyze and interpret these datasets. The hands-on workshop will teach students how to utilize the state-of-the-art computational workflows to create reproducible pipelines for data analysis. Students will also learn the best practices in data management, organization and sharing, with a focus on the big data generated by modern sequencing techniques in the life sciences. Enrollment is restricted to second year MCBGP PhD students. This is a half credit course.",https://bulletin.brown.edu/biologyandmedicine/biology-graduate/,3.5,Pipeline,delivery_and_storage-3,"{""pipeline"": 1}"
BIOL 2024. Gene and RNA Therapeutic Development,"The field of gene and RNA-based therapeutic development has had a profound impact on our ability to treat many unmet medical needs. By targeting the genetic basis of a given disease, it has become possible to regulate, limit, or modify the expression of the associated transcript, and in some cases, completely replace the impacted gene. This course provides a comprehensive exploration into the field of gene-modifying therapeutics, focusing on gene therapy and oligonucleotide therapy. Students will delve into the mechanisms of action, innovative delivery methods, evolving development pipelines, and the strengths and limitations of each therapeutic modality. Students will gain a comprehensive understanding of genetic therapeutics, preparing them to contribute to the advancement of this field and the translation of innovative therapies from bench to bedside. Preference is given to students in the Biotech Master's and Therapeutic Science PhD programs.",https://bulletin.brown.edu/biologyandmedicine/biology-graduate/,3.5,Pipeline,delivery_and_storage-3,"{""pipeline"": 1}"
BIOL 2245. Blood Substitutes: Principles and Therapeutics Development,"Blood serves many critical functions including respiratory gas transport, hemostasis and host defense. Plasma and cellular components of blood, their functional mechanisms, pathophysiologic consequencies when deficient and current treatments will be reviewed. Finally, development of blood component substitutive therapeutics (blood substitutes) based on protein and cellular engineering technologies (biotherapeutics) will be discussed. Open to Graduates students and Juniors and Seniors who meet the pre-requisites BIOL 0800 and BIOL 0280 or with instructor's permission.",https://bulletin.brown.edu/biologyandmedicine/biology-graduate/,3.5,Gas Transport,delivery_and_storage-3,"{""gas transport"": 1}"
ENGN 0150. Principles of Chemical and Atomistic Engineering,"This course introduces students to core concepts of chemical and molecular engineering. Students will learn to formulate, derive, and solve material and energy balances for chemical systems. Examples will be drawn from diverse application areas that are relevant to chemical engineering in the twenty-first century. These examples will emphasize how to break down complex problems into simpler components, how to derive the governing equations from first principles, and how to obtain the solution using numerical methods. Students will learn fundamentals of molecular modeling methods, and how atomistic techniques can be applied to engineering problems. The course is appropriate for students concentrating in any field of engineering, or related fields such as chemistry, physics, or biology.",https://bulletin.brown.edu/engineering/,2.5,Chemical Engineering,engineering_capabilities-2,"{""chemical engineering"": 1}"
ENGN 0410. Materials Science,"Relationship between the structure of matter and its engineering properties. Topics: primary and secondary bonding; crystal structure; atomic transport in solids; defects in crystals; mechanical behavior of materials; phase diagrams and their utilization; heat treatment of metals and alloys; electrical and optical properties of materials; strengthening mechanisms in solids and relationships between microstructure and properties. Lectures, recitations, laboratory.",https://bulletin.brown.edu/engineering/,2.5,Materials Science,engineering_capabilities-2,"{""materials science"": 1}"
ENGN 1120. Reaction Kinetics and Reactor Design,"Mechanisms, driving forces, and rate expressions of homogeneous and heterogeneous chemical and biochemical systems. Kinetics described from the potential energy surface to reaction networks. Basic concepts in reactor design and idealized reactor models. Chemostats and enzymatic reactors. Optimization. Temperature and energy effects in reactors. Catalysts and coupled transport effects. Prerequisite: ENGN 0720 or equivalent. Offered in alternate years.",https://bulletin.brown.edu/engineering/,3.5,Catalyst,production-3,"{""catalyst"": 1}"
ENGN 1340. Water Supply and Treatment Systems - Technology and Sustainability,"This course provides a comprehensive overview of engineering approaches how to protect water quality. Class begins with brief introduction to hydrological cycle. More in detail groundwater flows (Darcy eq.-n) and flows into wells are examined. Principles of hydraulics are presented. Open channel and river flows, flood routing and preventing are presented. Freshwater and wastewater treatment technologies, together with advanced water treatment processes, are evaluated. Course ends with the visit to a local wastewater treatment plant. Prerequisites: CHEM 0330 and ENGN 0040 . Recommended ENGN 0810 .",https://bulletin.brown.edu/engineering/,6.0,Sustainability;Water Quality,technical_skills-1;sustainability_and_policy-4,"{""sustainability"": 1, ""water quality"": 1}"
ENGN 1400. Analytical Methods in Biomaterials,"Analytical methods and instrumentation currently used to characterize biomaterials. Specific methods/instrumentation covered include: molecular scale analysis (NMR, FTIR, UV-Vis spectroscopy); surface anaylsis (AFM, SEM, XPS, contact angle goniometry, ellipsometry, quartz crystal microbalance, electrochemistry, grazing angle IR); bulk analysis (DSC, mechanical testing) and biological analyis (bioassays, flourescence and confocal microscopy). Prerequisites: CHEM 0330 , CHEM 0350 , ENGN 0040 and BIOL 0200 . Enrollment limited to 40.",https://bulletin.brown.edu/engineering/,2.5,Electrochemistry,engineering_capabilities-2,"{""electrochemistry"": 1}"
