title,description,relevance_score,matched_keywords,matched_groups,keyword_frequencies
CH 2290 - Organic Chemistry Laboratory,1 Credit (3 Contact Hours) One-semester laboratory for Chemical Engineering students. Credit toward a degree will be given for only one of or CH 2290. Preq: .,2.5,Chemical Engineering,engineering_capabilities-2,"{""chemical engineering"": 1}"
AGM 4520 - Mobile Power,"3 Credits (2 Contact Hours) Study of tractors, emphasizing internal combustion engines and support systems necessary for their proper functioning. Also considers application of power, maintenance, adjustment, and general repair. Preq: or or . Coreq: . This 4000-level course has a 6000-level counterpart. Students should refer to the Graduate Catalog for the 6000-level description and requirements.",2.5,Combustion,engineering_capabilities-2,"{""combustion"": 1}"
AGM 4071 - Applied Measurement and Instrumentation for Agricultural Automation Laboratory,0 Credits (2 Contact Hours) Non-credit laboratory to accompany . Coreq: .,1.5,Automation,technical_skills-1,"{""automation"": 1}"
AGM 4070 - Applied Measurement and Instrumentation for Agricultural Automation,"3 Credits (2 Contact Hours) Introduces the use of sensors, actuators, computers, and microcontrollers for monitoring plant environment, acquiring and processing data in agricultural automation. Students develop an understating of the use of these technologies and apply this knowledge in their semester projects and Capstone project or in their graduate research projects. Preq: and . Coreq: . This 4000-level course has a 6000-level counterpart. Students should refer to the Graduate Catalog for the 6000-level description and requirements.",2.0,Automation,technical_skills-1,"{""automation"": 2}"
AGM 4050 - Environmental Control in Animal Structures,"3 Credits (2 Contact Hours) Design of environmental control systems for animal production facilities. Topics include effects of the thermal and chemical environment on animals, ventilation system design, thermal design of structural envelopes, design of heating, cooling, and lighting systems. Emphasis is on practical, energy-efficient applications to modern animal production facilities. Preq: and . Coreq: . This 4000-level course has a 6000-level counterpart. Students should refer to the Graduate Catalog for the 6000-level description and requirements.",1.5,Control Systems,technical_skills-1,"{""control systems"": 1}"
AGM 4000 - Senior Seminar in Agricultural Mechanization and Business,"1 Credits (1 Contact Hours) This seminar-based course focuses on developing skills in critical thinking, problem solving, professional ethics, and oral and written communication. Students develop a proposal for a capstone project that is completed in AGM 4720 the following semester. Topics in the this seminar are related to agricultural production, agribusiness and resource management. Preq: Senior standing in Agricultural Mechanization and Business; and , , , , , , , and ; and either or .",1.5,Resource Management,technical_skills-1,"{""resource management"": 1}"
AGM 2050 - Principles of Fabrication,"3 Credits (2 Contact Hours) Principles, techniques, and methods in the selection, proper use, and maintenance of hand and power tools. Principal topics include welding, tool fitting, metalworking, woodworking, finishing and preserving, and heat treatment. Coreq: .",3.5,Welding,delivery_and_storage-3,"{""welding"": 1}"
"ANTH (JUST, SOC) 4820 - Spatial Inequality and GIS","3 Credits (3 Contact Hours) This course examines the theories and methods used in spatial inequality research-the study of “who gets what where and why.” The course introduces students to geographic information systems (GIS) and examines spatial disparities related to poverty, health, crime, pollution, and racial and socioeconomic segregation. May also be offered as or . Preq: or or or or . This 4000-level course has a 6000-level counterpart. Students should refer to the Graduate Catalog for the 6000-level description and requirements.",2.5,Geographic Information Systems,engineering_capabilities-2,"{""geographic information systems"": 1}"
ANTH 3280 - The Future of Humanity,"3 Credits (3 Contact Hours) This course examines the future of humanity through a lens of humanity’s past and present. Human biological variation and cultural diversity have created many strategies for dealing with climate change, environmental sustainability, disease, warfare, inequality, and other global challenges. These diverse strategies provide a model and context for examining how humanity can successfully adapt to challenges of the future. Preq: Sophomore standing.",4.5,Sustainability,sustainability_and_policy-4,"{""sustainability"": 1}"
ANTH 3250 - The Anthropology of Food,"3 Credits (3 Contact Hours) This course explores factors leading to the diverse development of foodways across the world and the ways in which people use food to make sense of life. It uses food as a lens to examine some of the most important issues facing today’s societies: economy, sustainability, politics, identity and globalization.",4.5,Sustainability,sustainability_and_policy-4,"{""sustainability"": 1}"
ART 3090 - Sculpture,"3 Credits (6 Contact Hours) Continuation of ART 2090 with increased emphasis on personal expression and content of work. Further exploration of materials and processes, including an introduction to foundry casting and advanced welding techniques. Individual investigation into current and historical aspects of sculpture is required. Preq: .",3.5,Welding,delivery_and_storage-3,"{""welding"": 1}"
AUE 4030 - Automotive Project Tools and Prototyping,"3 Credits (3 Contact Hours) This course introduces the concept of mobility systems engineering and new product development. Students learn through project-based learning and application of product development, innovation management, and concept validation through engineering tools. The project follows the automotive industry standard APQP/PPAP process and culminates with a prototype build and final demonstration. Preq: (or and and ) and .",2.5,Systems Engineering,engineering_capabilities-2,"{""systems engineering"": 1}"
AUE 3010 - Energy for Mobility,"3 Credits (3 Contact Hours) This course is designed to help students understand the energy transfer process within a single vehicle and between a vehicle and its surrounding environment such as electric charging infrastructure, renewable energy sources, and the power grid. Basic energy components are introduced along with an overview of vehicle charging, grid integration, and fossil fuels versus renewable low-carbon fuels. The concept of life-cycle CO emissions and the impact of each energy carrier on life-cycle CO are discussed. Preq: and .",4.5,Renewable Energy,sustainability_and_policy-4,"{""renewable energy"": 1}"
AUE 3020 - Propulsion Systems Design,"3 Credits (3 Contact Hours) This course provides an in-depth analysis of a vehicle’s powertrain components and the energy conversion processes, including combustion engines, batteries, electric motors, and fuel cells. The details of energy conversion and storage in hybrids and EVs and propulsion systems and sub-system design is discussed. Powertrain operational requirements are discussed in the context of vehicle-level performance, fuel economy, and emissions. Preq: and .",6.0,Fuel Cell;Combustion,use-3;engineering_capabilities-2,"{""fuel cell"": 1, ""combustion"": 1}"
BIOL 4480 - Marine Ecology,"3 Credits (3 Contact Hours) Study of ecological principles underlying the relationships of marine organisms to their ocean environment. Includes physiological, behavioral, population, and community ecology with applications to conservation and sustainability of marine resources. Includes Honors sections. Preq: or . This 4000-level course has a 6000-level counterpart. Students should refer to the Graduate Catalog for the 6000-level description and requirements.",4.5,Sustainability,sustainability_and_policy-4,"{""sustainability"": 1}"
"BIOL 2040 - Environment, Energy and Society","3 Credits (3 Contact Hours) Examines power and energy production, the resultant environmental effects, and the relationship between this technology and society. Introduces historical and contemporary sources of energy and power; the economic, social, and political forces important for types and patterns of development; and the resultant impacts to ecosystems and the environment.",4.5,Energy and Society,sustainability_and_policy-4,"{""energy and society"": 1}"
BIOE 4390 - Introduction to Medical Device Reprocessing,"3 Credits (3 Contact Hours) Detailed overview of regulations and best practices in the medical device reprocessing industry. Covers device design, usability, material selection, and manufacturing techniques with an emphasis on remanufacturing, reprocessing and sustainability. Addresses Quality System Regulations and compliance with global standards for process verification and validation in healthcare and industry settings. Preq: Senior standing in the College of Engineering, Computing and Applied Sciences or the College of Science. This 4000-level course has a 6000-level counterpart. Students should refer to the Graduate Catalog for the 6000-level description and requirements.",6.0,Material Selection;Sustainability,sustainability_and_policy-4;technical_skills-1,"{""sustainability"": 1, ""material selection"": 1}"
BIOE 4380 - Engineering Controls and Validation for Microbiological Systems,"3 Credits (2 Contact Hours) Detailed overview of cleaning, disinfection/sterilization, and packaging requirements for reprocessing medical devices. Emphasizes biocompatibility, process controls, and cleaning/disinfection/sterilization systems in manufacturing and healthcare sectors. It includes a laboratory for developing skills and techniques for working with bacteria safely and applying fundamental concepts of biology and biochemistry to problems related to medical device cleaning, disinfection, and sterilization. Addresses compliance with global regulations and standards, including instructions for use, methods for cleaning and sterilization validation, equipment design, and packaging processes. Coreq: . This 4000-level course has a 6000-level counterpart. Students should refer to the Graduate Catalog for the 6000-level description and requirements.",1.5,Process Control,technical_skills-1,"{""process control"": 1}"
BIOL 3110 - Introduction to Toxicology,"3 Credits (3 Contact Hours) This course provides a first introduction to the field of toxicology and covers the basic concepts of toxicology, followed by typical examples of toxicological issues in medical and pharmaceutical fields, food toxicology and pesticides, occupational exposures, natural toxins, environmental toxicology, and risk assessment. Special attention is given to the interactions between the science of toxicology and societal implications. Preq: and ; or . Preq or concurrent enrollment: or .",1.5,Risk Assessment,technical_skills-1,"{""risk assessment"": 1}"
BIOE 3020 - Biomaterials,"3 Credits (2 Contact Hours) Study of metallic, ceramic, and polymer materials used for surgical and dental implants; materials selection, implant design, physical and mechanical testing; corrosion and wear in the body. In addition, physical and mechanical properties of tissue as related to microstructure are studied. Preq: One of the two following combinations: (1) and ; and either both and , or both and ; or (2) and ; and either or . Coreq: .",1.5,Corrosion,technical_skills-1,"{""corrosion"": 1}"
CH 1020 - General Chemistry,"4 Credits (3 Contact Hours) Continuation of CH 1010, treating solutions, rates of reactions, chemical equilibrium, electrochemistry, chemistry of selected elements, and an introduction to organic chemistry. Credit toward a degree will be given for only one of CH 1020 or . Includes Honors sections. Preq: with a C or better. Coreq: .",2.5,Electrochemistry,engineering_capabilities-2,"{""electrochemistry"": 1}"
CHE 4950 - Honors Research II,3 Credits (9 Contact Hours) Individual research under the direction of a chemical engineering faculty member. Preq: .,2.5,Chemical Engineering,engineering_capabilities-2,"{""chemical engineering"": 1}"
CHE 4910 - Special Projects in Chemical Engineering,"1-3 Credits (1-3 Contact Hours) Topics requested by students or offered by faculty as the need arises. Topics may include review of current research in an area, technological advances, and national engineering goals. Includes Honors sections. May be repeated for a maximum of six credits, but only if different topics are covered.",2.5,Chemical Engineering,engineering_capabilities-2,"{""chemical engineering"": 1}"
CHE 4650 - Pharmaceutical Engineering Processes,"3 Credits (3 Contact Hours) An overview of the pharmaceutical engineering processes used in large scale production of drug products, recognizing that the great majority of modern drug products are chemicals. Topics covered include pathophysiology, medicinal chemistry, dosage forms, and the unique unit operations involved in scaling up drug products. This course helps prepare chemical engineering students to enter the pharmaceutical industry. Preq: . This 4000-level course has a 6000-level counterpart. Students should refer to the Graduate Catalog for the 6000-level description and requirements.",2.5,Chemical Engineering,engineering_capabilities-2,"{""chemical engineering"": 1}"
CHE 4500 - Chemical Reaction Engineering,"3 Credits (3 Contact Hours) Review of kinetics of chemical reactions and an introduction to the analysis and design of chemical reactors. Topics include homogeneous and heterogeneous reactions, batch and continuous flow reaction systems, catalysis, and design of industrial reactors. Preq: and . This 4000-level course has a 6000-level counterpart. Students should refer to the Graduate Catalog for the 6000-level description and requirements.",3.5,Catalysis,production-3,"{""catalysis"": 1}"
CHE 4530 - Process Dynamics and Control,3 Credits (3 Contact Hours) Mathematical analysis of the dynamic response of process systems. Basic automatic control theory and design of control systems for process applications. Preq: and . Preq or concurrent enrollment: . This 4000-level course has a 6000-level counterpart. Students should refer to the Graduate Catalog for the 6000-level description and requirements.,1.5,Control Systems,technical_skills-1,"{""control systems"": 1}"
CHE 4450 - Selected Topics in Chemical Engineering,"3 Credits (3 Contact Hours) Topics not covered in other courses, emphasizing current literature, research, and practice of chemical engineering. Topics vary from year to year. May be repeated, but only if different topics are covered. Preq: Consent of instructor. This 4000-level course has a 6000-level counterpart. Students should refer to the Graduate Catalog for the 6000-level description and requirements.",3.0,Chemical Engineering,engineering_capabilities-2,"{""chemical engineering"": 2}"
"CHE 4430 - Safety, Environmental and Professional Practice I","3 Credits (3 Contact Hours) Preparation of senior chemical engineering students for entry into the profession with an emphasis on process safety. Timely information is presented on career options for chemical engineers, professional practice, and a host of safety-related topics. Outside speakers are used frequently. Preq or concurrent enrollment: .",3.0,Chemical Engineering;Process Safety,engineering_capabilities-2,"{""chemical engineering"": 1, ""process safety"": 1}"
CHE 4160 - Energy Storage,"3 Credits (3 Contact Hours) This course covers the fundamentals of electrical energy storage systems for transportation, with a focus on advanced batteries, super capacitors and fuel cells. Students develop skills and knowledge necessary for a career in electrical transportation, which includes the essential engineering background. Primary course topics are basic principles of energy storage devices and systems; packaging and thermal management; and battery sizing, integration, and hybrid system comprising various types of devices. It is recommended that students have general knowledge of chemistry and materials prior to enrolling in this course. Preq: Junior standing. This 4000-level course has a 6000-level counterpart. Students should refer to the Graduate Catalog for the 6000-level description and requirements.",3.5,Fuel Cell,use-3,"{""fuel cell"": 1}"
CHE 4140 - Green Engineering,"3 Credits (3 Contact Hours) Green chemistry/engineering principles are applied to process and product design. Green engineering metrics are applied to quantify the sustainability, life cycle and environmental impact of chemical technologies, processes and products. Emphasis is placed on industrial sustainability, product innovation, risk assessment, policy and societal implications. Preq: and .",6.5,Risk Assessment;Sustainability,sustainability_and_policy-4;technical_skills-1,"{""sustainability"": 2, ""risk assessment"": 1}"
CHE 3950 - Honors Research I,3 Credits (9 Contact Hours) Individual research under the direction of a Chemical Engineering faculty member. Preq: .,2.5,Chemical Engineering,engineering_capabilities-2,"{""chemical engineering"": 1}"
CHE 3210 - Chemical Engineering Thermodynamics II,"3 Credits (3 Contact Hours) Continuation of CHE 2200. Topics include thermodynamics of power cycles and refrigeration/liquefaction, thermodynamic properties of homogeneous mixtures, phase equilibria, and chemical reaction equilibria. Preq: and .",6.0,Chemical Engineering;Liquefaction,delivery_and_storage-3;engineering_capabilities-2,"{""liquefaction"": 1, ""chemical engineering"": 1}"
CHE 3070 - Unit Operations Laboratory I,"3 Credits (2 Contact Hours) Laboratory work in the unit operations of fluid flow, heat transfer, and evaporation. Stress is on the relation between theory and experimental results and the statistical interpretation of those results and on report preparation and presentation. Preq: and . Coreq: .",1.5,Heat Transfer,technical_skills-1,"{""heat transfer"": 1}"
CHE 2301 - Fluids/Heat Transfer Laboratory,0 Credits (2 Contact Hours) Non-credit laboratory to accompany . Coreq: .,1.5,Heat Transfer,technical_skills-1,"{""heat transfer"": 1}"
CHE 2300 - Fluids/Heat Transfer,"4 Credits (3 Contact Hours) General principles of chemical engineering and study of fluid flow, fluid transportation, and heat transmission. Special emphasis is placed on theory and its practical application to design. Preq: . Preq or concurrent enrollment: and . Coreq: .",4.0,Chemical Engineering;Heat Transfer,technical_skills-1;engineering_capabilities-2,"{""chemical engineering"": 1, ""heat transfer"": 1}"
CHE 2200 - Chemical Engineering Thermodynamics I,"3 Credits (3 Contact Hours) Topics include first and second laws of thermodynamics, ideal gases, PVT properties of real fluids, energy balances with chemical reactions, and thermodynamic properties of real fluids. Preq: and .",2.5,Chemical Engineering,engineering_capabilities-2,"{""chemical engineering"": 1}"
CHE 2110 - Mass and Energy Balances,"4 Credits (3 Contact Hours) Introduction to fundamental concepts of chemical engineering, including mass and energy balances, PVT relationships for gases and vapors, and elementary phase equilibria; problem-solving and computer skills are developed in lab. Preq: with a C or higher; and and and . Coreq: .",2.5,Chemical Engineering,engineering_capabilities-2,"{""chemical engineering"": 1}"
CHE 1300 - Introduction to Chemical Engineering,"3 Credits (3 Contact Hours) Tools and methods for analyzing engineering problems with applications in chemical and biochemical processes, including development of process flow diagrams, numerical methods, graphing, and applied statistics. Problem-solving and computer skills are developed in the lecture and laboratory activities. Preq: with a C or better and either or with a C or better. Preq or concurrent enrollment: or ; and .",2.5,Chemical Engineering,engineering_capabilities-2,"{""chemical engineering"": 1}"
BT 2400 - Biosystems Technology II,"3 Credits (2 Contact Hours) Introduces basic unit operations used in bioprocessing for biofuels and other bioproducts. Covers operation and selection of pumps, heat exchangers, separation systems and sensors used in bioprocessing. Laboratory includes hands-on exercises, problem-solving/computer sessions, and oral presentations. Preq: . Coreq: .",3.5,Biofuels,use-3,"{""biofuels"": 1}"
BT 2200 - Biosystems Technology I,"3 Credits (2 Contact Hours) Introduces fundamental and applied concepts used in bioprocessing for biofuels and other high value compounds. Topics include operation of batch and continuous flow bioreactors, microbial growth in anaerobic and aerobic environments, fermentation for biofuel production, and use of renewable energy in bioprocessing. Laboratory includes hands-on exercises, problem-solving/computer sessions and oral presentations. Preq: and and . Coreq: .",8.0,Renewable Energy;Biofuels,use-3;sustainability_and_policy-4,"{""biofuels"": 1, ""renewable energy"": 1}"
BE 4990 - Creative Inquiry in Biosystems Engineering IV,"1-3 Credits (1-3 Contact Hours) In consultation with and under the direction of a faculty member, students pursue scholarly activities individually or in teams. These creative inquiry projects may be interdisciplinary. Arrangements with mentors must be established prior to registration. To be taken Pass/No Pass only. May be taken twice for a maximum of six credits.",2.5,Systems Engineering,engineering_capabilities-2,"{""systems engineering"": 1}"
BE 4740 - Biosystems Engineering Design Project Management,"1 Credit (1 Contact Hour) Study of biological systems design using hydrology principles, fluid mechanics, bioprocessing, heat/mass transfer, instrumentation, mechanical unit operations, and structural principles for project design, scheduling, and cost estimation. Topics also include engineering ethics, professional development, written and oral communication, and job skills. Senior portfolios are also developed. Preq: Senior standing in Biosystems Engineering. Coreq: .",3.5,Systems Engineering;Project Management,engineering_capabilities-2,"{""project management"": 1, ""systems engineering"": 2}"
BE 4750 - Biosystems Engineering Capstone Design,"3 Credits (6 Contact Hours) Students apply engineering knowledge to develop solutions to open-ended biosystems engineering problems. Designs are evaluated by faculty and practicing engineers based on appropriate use of engineering principles, consideration of ecological, economic and societal impacts, and clear communication. A final presentation and report are required. Preq: with a grade of or higher; and , , , and . Preq or concurrent enrollment: . Coreq: .",3.0,Systems Engineering,engineering_capabilities-2,"{""systems engineering"": 2}"
BE 4730 - Special Topics in Biosystems Engineering,"1-3 Credits (1-3 Contact Hours) Comprehensive study of special topics not covered in other courses. Emphasizes independent pursuit of detailed investigations. May be repeated for a maximum of six credits, but only if different topics are covered. Preq: Consent of instructor.",2.5,Systems Engineering,engineering_capabilities-2,"{""systems engineering"": 1}"
"BE (EES, FOR) 4510 - Biosystems Engineering Seminar","1 Credit (2 Contact Hours) Topics dealing with development and protection of land, air, water, and related resources are covered by seminar with instructor and invited lecturers. Current environmental and/or resource conservation issues are addressed. Includes Honors sections. May also be offered as or . May be repeated for a maximum of six credits. Preq: Senior standing. This 4000-level course has a 6000-level counterpart. Students should refer to the Graduate Catalog for the 6000-level description and requirements.",2.5,Systems Engineering,engineering_capabilities-2,"{""systems engineering"": 1}"
BE 4400 - Sustainable Energy Engineering,"3 Credits (2 Contact Hours) Investigation into merging renewable energy resources, including detailed study of solar, wind, and bioenergy alternatives. Also includes principles, technologies, and performance evaluation of components for these technologies and an introduction to tidal, hydro, geothermal, and other energy; energy conservation; cogeneration; financial, economical, and other issues related to alternative energy sources. Preq: with a or better. Coreq: . This 4000-level course has a 6000-level counterpart. Students should refer to the Graduate Catalog for the 6000-level description and requirements.",4.5,Renewable Energy,sustainability_and_policy-4,"{""renewable energy"": 1}"
BE 4381 - Bioprocess Engineering Design Laboratory,0 Credits (2 Contact Hours) Non-credit laboratory to accompany . Coreq: . This 4000-level course has a 6000-level counterpart. Students should refer to the Graduate Catalog for the 6000-level description and requirements.,2.5,Process Engineering,engineering_capabilities-2,"{""process engineering"": 1}"
BE 4380 - Bioprocess Engineering Design,"3 Credits (2 Contact Hours) Design and analysis of systems for processing biological materials. Topics include biotechnology, thermodynamics, transport processes, and biological properties related to bioprocess design and computational simulation. Unit operations include basic bioreactor operation, bioseparations, and preservation techniques. Preq or concurrent enrollment: or or . Coreq: . This 4000-level course has a 6000-level counterpart. Students should refer to the Graduate Catalog for the 6000-level description and requirements.",2.5,Process Engineering,engineering_capabilities-2,"{""process engineering"": 1}"
