title,description,relevance_score,matched_keywords,matched_groups,keyword_frequencies
BE 4280 - Biochemical Engineering,"3 Credits (3 Contact Hours) Use of microorganisms and enzymes for the production of chemical feedstocks, single-cell protein, antibiotics, and other fermentation products. Topics include kinetics and energetics of microbial metabolism, design and analysis of reactors for microbial growth and enzyme-catalyzed reactions, and considerations of scale-up, mass transfer, and sterilization during reactor design. Preq or concurrent enrollment: or . This 4000-level course has a 6000-level counterpart. Students should refer to the Graduate Catalog for the 6000-level description and requirements.",2.5,Chemical Engineering,engineering_capabilities-2,"{""chemical engineering"": 1}"
BE 4170 - Applied Instrumentation and Control for Biosystems,"2 Credits (1 Contact Hours) Hardware and software implementation of digital data acquisition and control systems for application to agriculture, aquaculture, biotechnology, and other biosystems. Topics include digital electronic circuits and components, microcomputer architecture, interfacing, and programming. Preq: . Coreq: . This 4000-level course has a 6000-level counterpart. Students should refer to the Graduate Catalog for the 6000-level description and requirements.",1.5,Control Systems,technical_skills-1,"{""control systems"": 1}"
BE 4150 - Instrumentation and Control for Biosystems Engineers,"3 Credits (2 Contact Hours) Overview of modern instrumentation techniques and digital electronic components and subsystems to integrate them into digital data acquisition and control systems for biosystems. Laboratory use of equipment is emphasized. Topics include characteristics of instruments, signal conditioning, transducer theory and applications, programmable logic controllers, and digital data acquisition and control. Preq: and . Coreq: . This 4000-level course has a 6000-level counterpart. Students should refer to the Graduate Catalog for the 6000-level description and requirements.",1.5,Control Systems,technical_skills-1,"{""control systems"": 1}"
BE 4141 - Biosystems Engineering Unit Operations Laboratory,0 Credits (3 Contact Hours) Non-credit laboratory to accompany . Coreq: . This 4000-level course has a 6000-level counterpart. Students should refer to the Graduate Catalog for the 6000-level description and requirements.,2.5,Systems Engineering,engineering_capabilities-2,"{""systems engineering"": 1}"
BE 4140 - Biosystems Engineering Unit Operations,"3 Credits (2 Contact Hours) Applies the basic principles of statics, dynamics, and thermodynamics to design of mechanical and electrical systems supporting biological operations and processes. Preq: and . Coreq: . This 4000-level course has a 6000-level counterpart. Students should refer to the Graduate Catalog for the 6000-level description and requirements.",2.5,Systems Engineering,engineering_capabilities-2,"{""systems engineering"": 1}"
BE 4120 - Heat and Mass Transport in Biosystems Engineering,"3 Credits (3 Contact Hours) Fundamentals of heat and mass transport used in engineering design and analysis of biological systems; principles of steady state and transient energy and mass balances, including chemical and biological generation terms. Preq: . This 4000-level course has a 6000-level counterpart. Students should refer to the Graduate Catalog for the 6000-level description and requirements.",2.5,Systems Engineering,engineering_capabilities-2,"{""systems engineering"": 1}"
BE 4000 - Biosystems Engineering Honors Thesis,3 Credits (6 Contact Hours) Individual research projects are conducted under the supervision and guidance of a faculty member. Senior honors thesis is required. Preq or concurrent enrollment: .,2.5,Systems Engineering,engineering_capabilities-2,"{""systems engineering"": 1}"
BE 3990 - Creative Inquiry in Biosystems Engineering III,"1-3 Credits (1-3 Contact Hours) In consultation with and under the direction of a faculty member, students pursue scholarly activities individually or in teams. These creative inquiry projects may be interdisciplinary. Arrangements with mentors must be established prior to registration. To be taken Pass/No Pass only. May be taken twice for a maximum of six credits.",2.5,Systems Engineering,engineering_capabilities-2,"{""systems engineering"": 1}"
BE 3700 - Practicum,"1-3 Credits (1-3 Contact Hours) Preplanned internship with an approved employer involved with biosystems engineering endeavors. A minimum 130 hours of supervised responsibility is required per credit hour. Evaluation is based on activity journal, written/oral report, and an evaluation from the supervisor. To be taken Pass/No Pass only. May be repeated for a maximum of three credits. Preq: Junior standing and consent of department.",2.5,Systems Engineering,engineering_capabilities-2,"{""systems engineering"": 1}"
BE 3140 - Biosystems Engineering Mechanical Design,3 Credits (3 Contact Hours) Study of basic mechanical design of biosystems. Includes an introduction to biomechanics and biomaterial properties. Studies applications of machine components and their selection related to specific types of biosystems. Team design project is required. Preq: .,2.5,Systems Engineering,engineering_capabilities-2,"{""systems engineering"": 1}"
BE 3010 - Biosystems Engineering Honors Thesis Research,"3 Credits (6 Contact Hours) Honors thesis project proposal, initial research, report, and presentation of biosystems engineering project for completion of junior requirements of the Biosystems Engineering Honors program. Preq: .",3.5,Systems Engineering,engineering_capabilities-2,"{""systems engineering"": 3}"
BE 3100 - Biosystems Engineering Thermodynamics,"3 Credits (3 Contact Hours) Introduction of basic thermodynamic principles pertaining to biosystems engineering with emphasis on biochemical, biomechanical, and ecological problems. Preq: .",3.0,Systems Engineering,engineering_capabilities-2,"{""systems engineering"": 2}"
BE 3000 - Biosystems Engineering Honors Seminar,0 Credits (0 Contact Hours) Introduces undergraduate students to current faculty research. Project ideas are then developed to prepare students in choosing a research topic for the senior honors thesis. Students are required to attend senior honors thesis presentations. To be taken Pass/No Pass only. Preq: Junior standing in departmental honors program.,2.5,Systems Engineering,engineering_capabilities-2,"{""systems engineering"": 1}"
BE 2990 - Creative Inquiry in Biosystems Engineering II,"1-3 Credits (1-3 Contact Hours) In consultation with and under the direction of a faculty member, students pursue scholarly activities individually or in teams. These creative inquiry projects may be interdisciplinary. Arrangements with mentors must be established prior to registration. To be taken Pass/No Pass only. May be taken twice for a maximum of six credits.",2.5,Systems Engineering,engineering_capabilities-2,"{""systems engineering"": 1}"
BE 2121 - Fundamentals of Biosystems Engineering Laboratory,0 Credits (3 Contact Hours) Non-credit laboratory to accompany . Coreq: .,2.5,Systems Engineering,engineering_capabilities-2,"{""systems engineering"": 1}"
BE 2120 - Fundamentals of Biosystems Engineering,"2 Credits (1 Contact Hour) Introduction to fundamental concepts in biosystems engineering, including mass, energy, and momentum balances; mass, heat, and momentum transfer; biological response to environmental variables, biological materials, biological kinetics, and techniques of measurement and analysis of engineering and biological data. Laboratory includes hand-on exercises, problem solving and computer sessions, and oral presentations. Preq: and , each with a grade of or higher. Coreq: .",3.0,Systems Engineering,engineering_capabilities-2,"{""systems engineering"": 2}"
BE 2101 - Introduction to Biosystems Engineering Laboratory,0 Credits (3 Contact Hours) Non-credit laboratory to accompany . Coreq: .,2.5,Systems Engineering,engineering_capabilities-2,"{""systems engineering"": 1}"
BE 2100 - Introduction to Biosystems Engineering,"2 Credits (1 Contact Hours) Overview of topics and engineering application areas that comprise the biosystems engineering profession. Significant emphasis is also given to development of oral and written communication skills needed by the engineering professional, introduction to design methodology, and application of engineering fundamentals to biological systems. Preq: ; and either or . Coreq: .",3.0,Systems Engineering,engineering_capabilities-2,"{""systems engineering"": 2}"
BE 1990 - Creative Inquiry in Biosystems Engineering I,"1-3 Credits (1-3 Contact Hours) In consultation with and under the direction of a faculty member, students pursue scholarly activities individually or in teams. These creative inquiry projects may be interdisciplinary. Arrangements with mentors must be established prior to registration. To be taken Pass/No Pass only. May be taken twice for a maximum of six credits.",2.5,Systems Engineering,engineering_capabilities-2,"{""systems engineering"": 1}"
BMOL 4290 - Bioprocess Engineering,3 Credits (3 Contact Hours) Chemical engineering principles are applied to bioprocess design. Emphasis is placed on designing bioreactors and bioseparation unit operations used in industrial biotechnology and the chemical process industry. Application of bioreaction and bioseparation operations to other chemical processes are discussed. Preq: and .,3.0,Chemical Engineering;Process Engineering,engineering_capabilities-2,"{""chemical engineering"": 1, ""process engineering"": 1}"
BMOL 4260 - Biosensors and Bioelectronic Devices,"3 Credits (3 Contact Hours) Development of methodologies used to design, fabricate, and apply biosensors and bioelectronic devices for the environmental, medical, and chemicals industries. Application of the fundamentals of measurement science to optical, electrochemical, mass, and thermal means of signal transduction. Use of the fundamentals of surface science to interpret bio-immobilization and biomolecule-surface interactions. Preq: ; and or . This 4000-level course has a 6000-level counterpart. Students should refer to the Graduate Catalog for the 6000-level description and requirements.",2.5,Electrochemical,engineering_capabilities-2,"{""electrochemical"": 1}"
CE 3310 - Construction Engineering and Management,"3 Credits (3 Contact Hours) Considers construction contracts, technical specifications, cost estimating, project scheduling, cost control, materials management, quality control, and quality assurance. Preq: Junior standing.",1.5,Quality Assurance,technical_skills-1,"{""quality assurance"": 1}"
CE 2550 - Geomatics,"3 Credits (2 Contact Hours) Spatial data collection methods, including surveying, digital photogrammetry and remote sensing, and global positioning systems. Methods and technologies used to manage, manipulate, and analyze spatial and associated attribute data, including geographic information systems. Preq or concurrent enrollment: . Coreq: .",2.5,Geographic Information Systems,engineering_capabilities-2,"{""geographic information systems"": 1}"
CE 2100 - Springer: Conceptual Site Design and Professional Communication,"2 Credits (1 Contact Hour) This course introduces the construction management, water resource, and site/transportation disciplines of civil engineering. Students work in teams to develop preliminary and final designs for a site design project. As part of the team project, students participate in a design charrette in which teams present their preliminary designs to stakeholders. Based on stakeholder feedback, teams complete a final design. A significant emphasis of Springer I is on oral communication skills. Preq: with a grade of or higher. Coreq: .",2.5,Construction Management,engineering_capabilities-2,"{""construction management"": 1}"
CRP 4301 - The Nature of Geographic Information Systems (GIS) Laboratory,0 Credits (3 Contact Hours) Non-credit laboratory to accompany . Coreq: . This 4000-level course has a 6000-level counterpart. Students should refer to the Graduate Catalog for the 6000-level description and requirements.,2.5,Geographic Information Systems,engineering_capabilities-2,"{""geographic information systems"": 1}"
CRP 4300 - The Nature of Geographic Information Systems (GIS),3 Credits (2 Contact Hours) Introduction to the theory and practical use of Geographic Information Systems (GIS). The course emphasizes geographic and statistical information and how it is represented and analyzed with computers. It introduces the concepts and components of a GIS and how they affect societal issues. Coreq: . This 4000-level course has a 6000-level counterpart. Students should refer to the Graduate Catalog for the 6000-level description and requirements.,3.0,Geographic Information Systems,engineering_capabilities-2,"{""geographic information systems"": 2}"
"CRP 2010 - Cities, Technology and Society","3 Credits (3 Contact Hours) Introduces students from a wide variety of disciplines to the study of cities with a special focus on the way new technologies have shaped social relations in urban areas and contributed to the causes and solutions to problems such as poverty, inequality, climate change, globalization, energy, water quality, conservation of natural areas, transportation, public health, and affordable housing.",1.5,Water Quality,technical_skills-1,"{""water quality"": 1}"
CH 4350 - Atomic and Molecular Structure,"3 Credits (3 Contact Hours) Introduction to quantum theory and its application to atomic and molecular systems. Topics include harmonic oscillator, hydrogen atom, atomic and molecular orbital methods, vector model of the atom, atomic spectroscopy, and molecular spectroscopy. Includes Honors sections. Preq: . This 4000-level course has a 6000-level counterpart. Students should refer to the Graduate Catalog for the 6000-level description and requirements.",5.5,Hydrogen,hydrogen_phrases-5,"{""hydrogen"": 1}"
CH 4060 - Mechanisms of Inorganic Reactions,"3 Credits (3 Contact Hours) Provides an introduction to the fundamentals of chemical kinetics and investigates the mechanisms of inorganic reactions, including substitution, electron transfer, and atom transfer reactions. Other factors in reaction mechanistic study, including linear free energy relationships, stereochemistry, catalysts, and isotope effects are introduced. Preq: .",3.5,Catalyst,production-3,"{""catalyst"": 1}"
CH 4030 - Advanced Multidisciplinary Laboratory in Experimental Chemistry,"2 Credits (6 Contact Hours) Senior-level advanced laboratory course that builds upon the synthetic and analytical techniques from organic chemistry, physical chemistry, and instrumental analysis lab courses via the preparation and study of inorganic and organometallic complexes and materials. Students learn to connect the observed spectroscopic (and other) properties and chemical reactivity of metal-containing molecules (and macromolecules) to foundational chemical principles. Special emphasis is placed on catalysis, polymerization, metal-containing multiple bonds, and carbon-based ligands. Preq: or ; and ; and ; and or .",3.5,Catalysis,production-3,"{""catalysis"": 1}"
CH 3390 - Physical Chemistry Laboratory,1 Credit (3 Contact Hours) Experiments are selected to be of maximum value to Chemistry and Chemical Engineering majors. Preq or concurrent enrollment: or .,2.5,Chemical Engineering,engineering_capabilities-2,"{""chemical engineering"": 1}"
CH 3320 - Physical Chemistry,"3 Credits (3 Contact Hours) Continuation of CH 3310, including chemical kinetics, liquid and solid state, phase equilibria, solutions, electrochemistry and surfaces. Includes Honors sections. Preq: or .",2.5,Electrochemistry,engineering_capabilities-2,"{""electrochemistry"": 1}"
CH 3300 - Introduction to Physical Chemistry,"3 Credits (3 Contact Hours) One-semester treatment of physical chemistry emphasizing topics that are especially useful in the life sciences, agriculture, and medicine: chemical thermodynamics, equilibrium, solutions, kinetics, electrochemistry, macromolecules, and surface phenomena. Credit toward a degree will be given for only one of CH 3300 or . Preq: .",2.5,Electrochemistry,engineering_capabilities-2,"{""electrochemistry"": 1}"
GEOL 2700 - Experiences in Sustainable Development: Water,"3 Credits (3 Contact Hours) Integrates cross-disciplinary perspectives on sustainability through active student participation in real-world development projects. Focuses on identifying and overcoming environmental, technical, social/organizational, and economic barriers to the sustainability of water resources. Emphasizes small-scale international water resources development.",5.0,Sustainability,sustainability_and_policy-4,"{""sustainability"": 2}"
MSE 4910 - Undergraduate Research,"2 Credits (4 Contact Hours) Investigation of a typical materials science and engineering research problem under the direct supervision of a faculty member. After completing the research, students prepare a formal written and oral report. Includes Honors sections. Preq: .",2.5,Materials Science,engineering_capabilities-2,"{""materials science"": 1}"
ME 4290 - Thermal Environmental Control,"3 Credits (3 Contact Hours) Mechanical vapor compression refrigeration cycles, refrigerants, thermoelectrical cooling systems, cryogenics, thermodynamic properties of air, psychometric charts, heating and cooling coils, solar radiation, heating and cooling loads, insulation systems. Preq: and , each with a C or better. This 4000-level course has a 6000-level counterpart. Students should refer to the Graduate Catalog for the 6000-level description and requirements.",4.0,Cryogenic;Cooling Systems,delivery_and_storage-3,"{""cooling systems"": 1, ""cryogenic"": 1}"
ME 4220 - Design of Gas Turbines,3 Credits (3 Contact Hours) Guiding principles in gas turbine cycles are reviewed. Turbine and compressor design procedures and performance prediction for both axial and radial flow machines are presented. Methods of design of rotary heat-exchangers and retrofitting gas turbine for regenerative operation are presented. Design projects are used to illustrate the procedures. Preq: with a C or better. This 4000-level course has a 6000-level counterpart. Students should refer to the Graduate Catalog for the 6000-level description and requirements.,3.5,Gas Turbine,engineering_capabilities-2,"{""gas turbine"": 3}"
ME 4180 - Finite Element Analysis in Mechanical Engineering Design,"3 Credits (2 Contact Hours) Introduction to the finite element method and solid modeling, finite element modeling and analysis using commercial codes; analysis strategies using finite elements; applications to heat transfer, fluid flow, and structures. Preq: and and , each with a or better. Coreq: . This 4000-level course has a 6000-level counterpart. Students should refer to the Graduate Catalog for the 6000-level description and requirements.",1.5,Heat Transfer,technical_skills-1,"{""heat transfer"": 1}"
ME 4030 - Control and Integration of Multidomain Dynamic Systems,"3 Credits (3 Contact Hours) Introduction of control theory with sensor, actuator, and dynamic plant integration to develop, model, control, and analyze mathematical models of dynamics systems, including mechanical, electrical, electromechanical, hydraulic and pneumatic systems. Transient dynamics are determined using analytical and numerical methods with feedback control systems. Strong emphasis is placed on system design using computer simulation tools. Preq: with a C or better.",1.5,Control Systems,technical_skills-1,"{""control systems"": 1}"
ME 3100 - Thermodynamics and Heat Transfer,"3 Credits (3 Contact Hours) Introduction to thermodynamics and heat transfer for nonmajors: properties of liquids and gases, first and second law analysis, introduction to cycles for power and refrigeration, heat flow by conduction and radiation, and convective heat flow and heat exchangers. Preq: and , each with a C or better; and enrollment in an engineering curriculum other than Mechanical Engineering.",2.0,Heat Transfer,technical_skills-1,"{""heat transfer"": 2}"
ME 3030 - Thermodynamics,3 Credits (3 Contact Hours) Study of the second law and entropy. Includes applications to fixed mass systems and control volumes; vapor and gas power cycles; mixtures of gases; vapor psychrometrics; combustion and the third law. Thermochemical equilibrium. Preq: with a C or better.,2.5,Combustion,engineering_capabilities-2,"{""combustion"": 1}"
ME 3040 - Heat Transfer,"3 Credits (3 Contact Hours) Study of steady and transient heat conduction, free and forced convection, radiation, and multi-mode heat transfer. Emphasizes analytical and numerical solutions to engineering heat transfer problems with a design orientation. Preq: and each with a C or better. Preq or concurrent enrollment: with a C or better.",2.5,Heat Transfer,technical_skills-1,"{""heat transfer"": 3}"
ME (ECE) 4570 - Fundamentals of Wind Power,"3 Credits (3 Contact Hours) Introduces wind turbine systems, including wind energy potential and application to power generation. Topics include wind energy principles, wind site assessment, wind turbine components, power generation machinery control systems, connection to the electric grid, and maintenance. May also be offered as . Preq: or , with a C or better. This 4000-level course has a 6000-level counterpart. Students should refer to the Graduate Catalog for the 6000-level description and requirements.",5.5,Control Systems;Power Generation,use-3;technical_skills-1,"{""power generation"": 2, ""control systems"": 1}"
ME 4550 - Design for Manufacturing,"3 Credits (3 Contact Hours) Concepts of product and process design for automated manufacturing are considered. Topics include product design for automated manufacturing, inspection and assembly, using automation, industrial robots, knowledge-based systems and concepts of flexible product manufacture. Preq: with a C or better. Preq or concurrent enrollment: with a C or better. This 4000-level course has a 6000-level counterpart. Students should refer to the Graduate Catalog for the 6000-level description and requirements.",1.5,Automation,technical_skills-1,"{""automation"": 1}"
ME 4510 - Electric Vehicle Propulsion,"3 Credits (3 Contact Hours) Introduction to electric drivetrains and propulsion systems in vehicles. Topics include fundamentals and modeling of advanced batteries, super capacitors and fuel cells, hybridization for vehicle electrification, battery management systems, thermal management systems battery safety, and global market analysis. Students conduct hands-on testing in laboratory facilities. Students are expected to have computer programming experience with Matlab/Simulink or the equivalent before enrolling in this class. This 4000-level course has a 6000-level counterpart. Students should refer to the Graduate Catalog for the 6000-level description and requirements.",3.5,Fuel Cell,use-3,"{""fuel cell"": 1}"
MSE 4970 - Honors Thesis,"1 Credits (1 Contact Hours) Students conduct materials science and engineering research, prepare an honors thesis, and summarize research conducted in and under the direction of a faculty member. Preq: .",2.5,Materials Science,engineering_capabilities-2,"{""materials science"": 1}"
MSE 4950 - Honors Research II,3 Credits (9 Contact Hours) Students conduct individual materials science and engineering research under the direction of a faculty member. Preq: .,2.5,Materials Science,engineering_capabilities-2,"{""materials science"": 1}"
MSE 4920 - Independent Study in Materials Science and Engineering,3 Credits (6 Contact Hours) Students develop research skills and techniques by completing research and/or develop a program of independent in-depth study in a subject area in which the professor and student have a common interest. May be repeated for a maximum of six credits. Preq: and and consent of instructor.,2.5,Materials Science,engineering_capabilities-2,"{""materials science"": 1}"
MSE 4900 - Selected Topics in Materials Science and Engineering,"3 Credits (3 Contact Hours) Study of topics not ordinarily covered in other courses. Taught as the need arises. Typical topics could include current research in a specific area or technological advances. Includes Honors sections. May be repeated for a maximum of 15 credits, but only if different topics are covered. This 4000-level course has a 6000-level counterpart. Students should refer to the Graduate Catalog for the 6000-level description and requirements.",2.5,Materials Science,engineering_capabilities-2,"{""materials science"": 1}"
MSE 4580 - Surface Phenomena in Materials Science and Engineering,"3 Credits (3 Contact Hours) Introduction to surface phenomena focusing on the materials science applications. Fundamentals of interfacial phenomena embrace capillarity, thermodynamics of surfaces, physics of adsorption, nucleation/condensation, adhesion, wetting, and finishing emphasizing specific features associated with interactions of liquids and chemicals with materials. Preq: Junior standing in engineering or science. This 4000-level course has a 6000-level counterpart. Students should refer to the Graduate Catalog for the 6000-level description and requirements.",3.0,Materials Science,engineering_capabilities-2,"{""materials science"": 2}"
