title,description,relevance_score,matched_keywords,matched_groups,keyword_frequencies
"JUST (ANTH, SOC) 4820 - Spatial Inequality and GIS","3 Credits (3 Contact Hours) This course examines the theories and methods used in spatial inequality research-the study of “who gets what where and why.” The course introduces students to geographic information systems (GIS) and examines spatial disparities related to poverty, health, crime, pollution, and racial and socioeconomic segregation. May also be offered as or . Preq: or or or or . This 4000-level course has a 6000-level counterpart. Students should refer to the Graduate Catalog for the 6000-level description and requirements.",2.5,Geographic Information Systems,engineering_capabilities-2,"{""geographic information systems"": 1}"
ECE 4100 - Industrial Control and Automation,"3 Credits (3 Contact Hours) Introduction to control systems specifically related to electrical and computer engineering industrial applications, and manufacturing and production systems. Topics include continuous variable control and the PID paradigm, applications of the Z-transform, digital control, model-predictive control, direct adaptive control, discrete logic control, ladder logic and PLC implementation, and equipment interfacing and industrial networking protocols. Preq: with a grade of or better.",2.0,Control Systems;Automation,technical_skills-1,"{""control systems"": 1, ""automation"": 1}"
ECE 4090 - Introduction to Linear Control Systems,"3 Credits (3 Contact Hours) Introduction to classical linear control systems. Topics include continuous and discrete descriptions of systems, time and frequency response, stability, system specification, system design of continuous and discrete systems. Preq: with a C or better.",2.0,Control Systems,technical_skills-1,"{""control systems"": 2}"
EES 4140 - Radioecology,3 Credits (3 Contact Hours) An introduction to the relationships between ionizing radiation or radioactive substances and the environment. Topics include sources of environmental radioactivity; transport processes and bioavailability; impacts of ionizing radiation on various subunits within the biosphere; and methods and techniques related to risk assessment and decision making. Preq: or ; and or ; and or . This 4000-level course has a 6000-level counterpart. Students should refer to the Graduate Catalog for the 6000-level description and requirements.,1.5,Risk Assessment,technical_skills-1,"{""risk assessment"": 1}"
FNPS 3680 - Packaging and Society,3 Credits (3 Contact Hours) Study of the role of packaging in society as it specifically relates to the responsibilities of the packaging scientist in protecting people and the environment. Includes study of packaging and environmental regulations and guidelines currently in place to achieve these goals. Ability to make informed decisions and ethical judgments is an encompassing goal. Includes Honors sections.,4.5,Environmental Regulation,sustainability_and_policy-4,"{""environmental regulation"": 1}"
STAT 4110 - Statistical Methods for Process Development and Control,"3 Credits (3 Contact Hours) Experimental design techniques for use in process development, application of screening experiments and response surface experiments, techniques for process control with implications for product quality control. Includes discussions of the use of statistical computer analyses and interpretations including computer-generated graphics. Preq: . This 4000-level course has a 6000-level counterpart. Students should refer to the Graduate Catalog for the 6000-level description and requirements.",1.5,Process Control,technical_skills-1,"{""process control"": 1}"
ELE 4070 - Technology Entrepreneurship,"3 Credits (3 Contact Hours) This course provides an introduction to technology entrepreneurship emphasizing ideation, opportunity assessment, market and technology forecasting, intellectual property protection, financial modeling and business valuation, project management, and cross-functional team building. Preq: . This 4000-level course has a 6000-level counterpart. Students should refer to the Graduate Catalog for the 6000-level description and requirements.",2.5,Project Management,engineering_capabilities-2,"{""project management"": 1}"
ETOX 4470 - Soil and Water Quality: Applications,"3 Credits (3 Contact Hours) Potential for water quality concerns arising from land application of natural or manufactured chemicals is varied. Case studies of potential water quality concerns related to fertilizers, pesticides, biosolids, manures, and other sources are presented. Practices that can improve water quality are also studied and evaluated. Preq: .",3.0,Water Quality,technical_skills-1,"{""water quality"": 4}"
"ETOX (GEOL, PES) 4850 - Environmental Soil Chemistry","3 Credits (3 Contact Hours) Study of soil chemical processes (sorption, desorption, ion exchange, precipitation, dissolution, and redox reactions) of nutrients and inorganic and organic contaminants in soils and organic matter. Chemical complex equilibria and adsorption phenomena at the solid (soil, sediment, and mineral) water interface are emphasized. May also be offered as or . Preq: or . This 4000-level course has a 6000-level counterpart. Students should refer to the Graduate Catalog for the 6000-level description and requirements.",3.5,Ion Exchange,production-3,"{""ion exchange"": 1}"
ETOX 4460 - Soil and Water Quality: Fundamentals,"3 Credits (3 Contact Hours) Studies those aspects of water quality that are influenced by soil systems. Many water quality concerns arise from land-applied chemicals, natural or manufactured. Basic soil and water chemistry principles including sorption, solution chemistry, and soil chemical transport are studied. Preq: .",2.5,Water Quality,technical_skills-1,"{""water quality"": 3}"
ENSP 3000 - Connecting Environmental Science and Policy,"3 Credits (3 Contact Hours) Investigation of issues in environmental science, sustainability, and policies to address those issues. Topics span disciplines and scales from global to local. Topics covered vary depending on instructor. Examples include climate change, mining, water quality, and ecosystems. Student participation through discussions and case studies is emphasized. Preq: Any course that satisfies the Natural Science with Lab General Education Requirement.",6.0,Water Quality;Sustainability,sustainability_and_policy-4;technical_skills-1,"{""sustainability"": 1, ""water quality"": 1}"
EES 4860 - Environmental Sustainability,"3 Credits (3 Contact Hours) Topics include sustainable engineering and industrial ecology with emphasis on pollution prevention methods using source reduction, recycling assessments, treatment to reduce disposal, life-cycle assessment and design for the environment. Emphasizes case studies. Preq: Junior standing. This 4000-level course has a 6000-level counterpart. Students should refer to the Graduate Catalog for the 6000-level description and requirements.",4.5,Sustainability,sustainability_and_policy-4,"{""sustainability"": 1}"
EES 4800 - Environmental Risk Assessment,"3 Credits (3 Contact Hours) Quantitative estimation of human health risk posed by the release of a contaminant to the environment. Topics include methods for analyzing emission rate, environmental transport, exposure, and health effects; methods of uncertainty analysis; and the role of risk assessment in environmental regulation and environmental decision making. Preq: or ; and with a C or better. This 4000-level course has a 6000-level counterpart. Students should refer to the Graduate Catalog for the 6000-level description and requirements.",6.5,Environmental Regulation;Risk Assessment,sustainability_and_policy-4;technical_skills-1,"{""environmental regulation"": 1, ""risk assessment"": 2}"
"EES (BE, FOR) 4510 - Biosystems Engineering Seminar","1 Credit (2 Contact Hours) Topics dealing with development and protection of land, air, water, and related resources are covered by seminar with instructor and invited lecturers. Current environmental and/or resource conservation issues are addressed. Includes Honors sections. May also be offered as or . May be repeated for a maximum of six credits. Preq: Senior standing. This 4000-level course has a 6000-level counterpart. Students should refer to the Graduate Catalog for the 6000-level description and requirements.",2.5,Systems Engineering,engineering_capabilities-2,"{""systems engineering"": 1}"
EES 2020 - Environmental Engineering Fundamentals II,"4 Credits (3 Contact Hours) Overview of fundamentals related to environmental engineering processes, including water treatment, wastewater treatment, solid and hazardous waste management, air pollution control, risk assessment, and pollutions prevention strategies. Laboratories cover measurement techniques and applications to process engineering. Preq: ; and one of or or , and either and , each with a grade of or better. Coreq: .",4.0,Risk Assessment;Process Engineering,technical_skills-1;engineering_capabilities-2,"{""process engineering"": 1, ""risk assessment"": 1}"
ENR 4500 - Conservation Issues,"3 Credits (3 Contact Hours) Interactive study and discussion of issues related to the conservation of natural resources, emphasizing current issues in the conservation of biodiversity, identification of conflicting issues between consumptive and nonconsumptive resource management, and development of viable solutions for conservation of natural resources. Preq: or . This 4000-level course has a 6000-level counterpart. Students should refer to the Graduate Catalog for the 6000-level description and requirements.",1.5,Resource Management,technical_skills-1,"{""resource management"": 1}"
"ENR (FOR, WFB) 4341 - Geographic Information Systems for Natural Resources Laboratory",0 Credits (3 Contact Hours) Non-credit laboratory to accompany . May also be offered as or . Coreq: . This 4000-level course has a 6000-level counterpart. Students should refer to the Graduate Catalog for the 6000-level description and requirements.,2.5,Geographic Information Systems,engineering_capabilities-2,"{""geographic information systems"": 1}"
"ENR (FOR, WFB) 4340 - Geographic Information Systems for Natural Resources","3 Credits (2 Contact Hours) Develops competence in geographic information systems (GIS) technology and its application to various spatial analysis problems in natural resources. Topics include data development and management, spatial analysis techniques, critical review of GIS applications, needs analysis and institutional context. GIS hardware and software, hands-on application. May also be offered as or . Preq: Junior standing. Coreq: . This 4000-level course has a 6000-level counterpart. Students should refer to the Graduate Catalog for the 6000-level description and requirements.",3.0,Geographic Information Systems,engineering_capabilities-2,"{""geographic information systems"": 2}"
ENR 3020 - Natural Resources Measurements,"3 Credits (2 Contact Hours) Introduction to measurements of natural resources including land, vegetation, animal habitat, water quality and quantity, climate, and recreation. Remote sensing techniques are also introduced. May not be taken for credit by Forest Resource Management majors. Preq or concurrent enrollment: . Coreq: .",2.0,Water Quality;Resource Management,technical_skills-1,"{""water quality"": 1, ""resource management"": 1}"
FNR 4520 - Environmental Justice in Natural Resources,"3 Credits (3 Contact Hours) In this class, it is assumed everyone has the right to live in a clean environment with resources managed with their best interests in mind. This course examines the history of social justice as it relates to natural resource management, the current state of the world in terms of environmental justice, and how these issues are approached from different perspectives. Areas of consideration include hunting, logging, recreation areas, and wildlife management areas, among others. Preq: Junior standing. This 4000-level course has a 6000-level counterpart. Students should refer to the Graduate Catalog for the 6000-level description and requirements.",1.5,Resource Management,technical_skills-1,"{""resource management"": 1}"
FNR 2040 - Soil Information Systems,"4 Credits (3 Contact Hours) Includes input, storage, analysis, and output of soil information through the use of global positioning systems, direct/remote sensing, geographic information systems, and web soil survey. Provides fundamental knowledge of the role of soils in forest and wildlife management. Preq: One of the following combinations: and ; or and (or a higher level general Physics course); or and . Coreq: .",2.5,Geographic Information Systems,engineering_capabilities-2,"{""geographic information systems"": 1}"
"FOR (BE, EES) 4510 - Biosystems Engineering Seminar","1 Credit (2 Contact Hours) Topics dealing with development and protection of land, air, water, and related resources are covered by seminar with instructor and invited lecturers. Current environmental and/or resource conservation issues are addressed. Includes Honors sections. May also be offered as or . May be repeated for a maximum of six credits. Preq: Senior standing. This 4000-level course has a 6000-level counterpart. Students should refer to the Graduate Catalog for the 6000-level description and requirements.",2.5,Systems Engineering,engineering_capabilities-2,"{""systems engineering"": 1}"
"FOR (ENR, WFB) 4341 - Geographic Information Systems for Natural Resources Laboratory",0 Credits (3 Contact Hours) Non-credit laboratory to accompany . May also be offered as or . Coreq: . This 4000-level course has a 6000-level counterpart. Students should refer to the Graduate Catalog for the 6000-level description and requirements.,2.5,Geographic Information Systems,engineering_capabilities-2,"{""geographic information systems"": 1}"
"FOR (ENR, WFB) 4340 - Geographic Information Systems for Natural Resources","3 Credits (2 Contact Hours) Develops competence in geographic information systems (GIS) technology and its application to various spatial analysis problems in natural resources. Topics include data development and management, spatial analysis techniques, critical review of GIS applications, needs analysis and institutional context. GIS hardware and software, hands-on application. May also be offered as or . Preq: Junior standing. Coreq: . This 4000-level course has a 6000-level counterpart. Students should refer to the Graduate Catalog for the 6000-level description and requirements.",3.0,Geographic Information Systems,engineering_capabilities-2,"{""geographic information systems"": 2}"
FOR 4260 - Forest Resource Management Plans Seminar,"1 Credits (1 Contact Hours) In-depth exploration of topics and problems presented in . To earn honors credit, students must be enrolled in in the same term as FOR 4260, and earn a B or better in both courses. Includes Honors sections. Preq: Senior standing and consent of instructor. Preq or concurrent enrollment: .",1.5,Resource Management,technical_skills-1,"{""resource management"": 1}"
FOR 4251 - Forest Resource Management Plans Laboratory,0 Credits (3 Contact Hours) Non-credit laboratory to accompany . Coreq: .,1.5,Resource Management,technical_skills-1,"{""resource management"": 1}"
FOR 4250 - Forest Resource Management Plans,2 Credits (1 Contact Hours) Development of multiple resource forest management plans. Economic and environmental impacts of implementing management plans. Preq: . Coreq: .,1.5,Resource Management,technical_skills-1,"{""resource management"": 1}"
FOR 4170 - Forest Resource Management and Regulation,"3 Credits (3 Contact Hours) Fundamental principles and analytical techniques in planning, management, and optimization of forest operations. Preq: and and and . This 4000-level course has a 6000-level counterpart. Students should refer to the Graduate Catalog for the 6000-level description and requirements.",1.5,Resource Management,technical_skills-1,"{""resource management"": 1}"
FOR 4060 - Forested Watershed Management,"2 Credits (1 Contact Hours) Lectures and discussions on measurements and processes affecting water quality and quantity within watersheds. Introduction to hydrologic principles, geomorphology, and water quality assessment. Discusses best management practices for silviculture and development of a watershed management plan. Coreq: .",2.0,Water Quality,technical_skills-1,"{""water quality"": 2}"
FOR (HORT) 2270 - Arboricultural Field Techniques,"1 Credits (3 Contact Hours) Covers hands-on techniques involved in tree management in urban landscapes, including climbing, pruning, fertilizing, pest control, cabling/bracing, lightening protection, and risk assessment. Safety, professional ethics and best management practices are emphasized. Guest instruction is provided in part by tree care industry professionals. May also be offered as .",1.5,Risk Assessment,technical_skills-1,"{""risk assessment"": 1}"
FDSC 4081 - Food Process Engineering Laboratory,0 Credits (3 Contact Hours) Non-credit laboratory to accompany . Coreq: . This 4000-level course has a 6000-level counterpart. Students should refer to the Graduate Catalog for the 6000-level description and requirements.,2.5,Process Engineering,engineering_capabilities-2,"{""process engineering"": 1}"
ECE 3600 - Electric Power Engineering,"Presents the basic principles of power systems, energy conversion, electromagnetic induction and developed forces. Topics include power and energy concepts and analysis; the basics of electric power generation, transmission, and distribution; synchronous machines, induction motors, and DC motors. Preq: and , each with a C or better.",3.5,Power Generation,use-3,"{""power generation"": 1}"
FDSC 4080 - Food Process Engineering,4 Credits (3 Contact Hours) Study of basic engineering principles and their application in food processing operations. Emphasizes the relation between engineering principles and fundamentals of food processing. Preq: Food Science and Human Nutrition major or Food Science minor; and and ; and one of or ; and one of or or . Coreq: . This 4000-level course has a 6000-level counterpart. Students should refer to the Graduate Catalog for the 6000-level description and requirements.,2.5,Process Engineering,engineering_capabilities-2,"{""process engineering"": 1}"
ECE 1010 - Robots in Business and Society,"3 Credits (3 Contact Hours) Explores the significant role robotics and automation play in society. Students gain an appreciation of the ethics, economics, psychology, politics and technologies that must be considered in the use of robots.",1.5,Automation,technical_skills-1,"{""automation"": 1}"
ECON 4580 - Natural Resource Use in the Global Economy,"3 Credits (3 Contact Hours) This course covers the application of microeconomic concepts and models to the use of natural resources in the global economy. Students evaluate the efficiency and sustainability of natural resource use, as well as the extent to which the use promotes economic development. Focus is on uses of energy resources, recyclable resources, land, and water and evaluation of policies that affect their use. Preq: or ; and or . . This 4000-level course has a 6000-level counterpart. Students should refer to the Graduate Catalog for the 6000-level description and requirements.",4.5,Sustainability,sustainability_and_policy-4,"{""sustainability"": 1}"
ECON 4290 - Economics of Energy Markets,"3 Credits (3 Contact Hours) This course examines the economics of energy markets and energy policy. The unique features and characteristics of these important and interrelated markets are explored, and participants gain practical experience in connecting economic concepts to recent energy-related events and energy policy issues. Preq: . This 4000-level course has a 6000-level counterpart. Students should refer to the Graduate Catalog for the 6000-level description and requirements.",10.0,Energy Policy;Energy Market,sustainability_and_policy-4;clean_energy_markets-4,"{""energy policy"": 2, ""energy market"": 2}"
SCI 3000 - Sustainable Energy: A Global Cost-Benefit Analysis,3 Credits (3 Contact Hours) Critical analyses of multiple renewable energy sources ranging from technological feasibility and economic viability to environmental harms and human rights abuses. Preq: and .,4.5,Renewable Energy,sustainability_and_policy-4,"{""renewable energy"": 1}"
CE 4840 - Design Thinking Approaches to Sustainable System Design,3 Credits (3 Contact Hours) Introduces the concepts of design thinking approach to enable engineers to design and evaluate systems that can effectively meet both human needs and sustainability objectives. Preq: Junior standing. This 4000-level course has a 6000-level counterpart. Students should refer to the Graduate Catalog for the 6000-level description and requirements.,4.5,Sustainability,sustainability_and_policy-4,"{""sustainability"": 1}"
CE 4550 - Sustainable Construction Materials,"3 Credits (3 Contact Hours) This course introduces students to various concepts related to the impact of construction materials such as Portland cement, aggregates, asphalt materials, steel, wood, polymers and ceramics on environment and sustainability. Field visits to LEED and Green Globes certified buildings on campus showcase various practices in the industry to improve sustainability. Oral and written communication skills are an integral part of this course. Preq: . This 4000-level course has a 6000-level counterpart. Students should refer to the Graduate Catalog for the 6000-level description and requirements.",5.0,Sustainability,sustainability_and_policy-4,"{""sustainability"": 2}"
CE (MSE) 4520 - Corrosion and Oxidation,"3 Credits (3 Contact Hours) Provides a comprehensive review of the subject and covers electrochemical reactions, thermodynamics and kinetics of corrosion, different types of corrosion, corrosion monitoring techniques, and corrosion prevention through materials selection, design, cathodic and anodic protection and coatings. May also be offered as . Preq: . This 4000-level course has a 6000-level counterpart. Students should refer to the Graduate Catalog for the 6000-level description and requirements.",6.0,Corrosion;Electrochemical,technical_skills-1;engineering_capabilities-2,"{""electrochemical"": 1, ""corrosion"": 5}"
CE 4470 - Stormwater Management,"3 Credits (2 Contact Hours) Evaluation of peak discharges for urban and rural basins, design of highway drainage structures such as inlets and culverts; stormwater and receiving water quality; best management practices, detention and retention ponds, and erosion and sediment control. Students will also learn appropriate technical communication and teamwork skills. Preq: with a grade of or better. Preq or concurrent enrollment: . Coreq: . This 4000-level course has a 6000-level counterpart. Students should refer to the Graduate Catalog for the 6000-level description and requirements.",1.5,Water Quality,technical_skills-1,"{""water quality"": 1}"
CE 4380 - Construction Support Operations,"3 Credits (3 Contact Hours) Describes activities necessary for the completion of a construction job although not specifically recognized as direct construction activities: general conditions, safety, security, quality assurance, value engineering; organizational support features and typical implementation procedures. Preq: and , each with a C or better. This 4000-level course has a 6000-level counterpart. Students should refer to the Graduate Catalog for the 6000-level description and requirements.",1.5,Quality Assurance,technical_skills-1,"{""quality assurance"": 1}"
CE 4310 - Building Information Modeling in Construction Management,"3 Credits (3 Contact Hours) The course provides an introduction to the theory of building information modeling (BIM). Students learn to develop BIM models for architecture and engineering purposes, and use them for performing design coordination, preparing construction cost estimates, and 4D construction schedules. Preq: . This 4000-level course has a 6000-level counterpart. Students should refer to the Graduate Catalog for the 6000-level description and requirements.",2.5,Construction Management,engineering_capabilities-2,"{""construction management"": 1}"
PRTM 3610 - Sport and Recreation Facility Management,"3 Credits (3 Contact Hours) An overview of the management of sport and recreation facilities and venues. Topics discussed and applied include planning models, project management principles, financing capital projects, human resource considerations, risk management and legal liability, and current issues and trends in facility management. Preq or concurrent enrollment: .",2.5,Project Management,engineering_capabilities-2,"{""project management"": 1}"
